Title,Description,Media,Price,Tags,Collection
iPhone X,at nunc commodo placerat praesent blandit nam nulla integer pede justo lacinia eget tincidunt eget tempus vel pede morbi porttitor lorem id ligula suspendisse ornare consequat lectus in est risus auctor sed tristique,http://dummyimage.com/210x100.png/cc0000/ffffff,$40.46,music,Antiques
Nike Air Max 90,vehicula consequat morbi a ipsum integer a nibh in quis justo maecenas rhoncus aliquam lacus morbi quis tortor id nulla ultrices aliquet maecenas leo odio condimentum id luctus nec molestie sed justo pellentesque viverra pede ac diam cras pellentesque volutpat dui,http://dummyimage.com/235x100.png/dddddd/000000,$52.03,fitness,Books
Rolex Submariner Watch,felis donec semper sapien a libero nam dui proin leo odio porttitor id consequat,http://dummyimage.com/177x100.png/dddddd/000000,$30.27,sports,Stamps
Microsoft Surface Pro,tellus semper interdum mauris ullamcorper purus sit amet nulla quisque arcu libero rutrum ac lobortis vel dapibus at diam nam tristique tortor,http://dummyimage.com/203x100.png/cc0000/ffffff,$37.66,music,Books
Amazon Echo Dot,augue luctus tincidunt nulla mollis molestie lorem quisque ut erat curabitur gravida nisi at nibh in hac habitasse platea dictumst aliquam,http://dummyimage.com/118x100.png/ff4444/ffffff,$70.70,movies,Antiques
Louis Vuitton Neverfull Tote,at turpis donec posuere metus vitae ipsum aliquam non mauris morbi non lectus aliquam sit amet diam in magna bibendum imperdiet nullam,http://dummyimage.com/229x100.png/dddddd/000000,$9.50,food,Coins
Canon EOS Rebel T6,fermentum donec ut mauris eget massa tempor convallis nulla neque libero convallis eget eleifend luctus,http://dummyimage.com/130x100.png/dddddd/000000,$98.50,books,Antiques
MacBook Pro,vestibulum sagittis sapien cum sociis natoque penatibus et magnis dis parturient montes nascetur ridiculus mus etiam vel augue vestibulum rutrum rutrum neque aenean auctor gravida sem praesent id massa id nisl venenatis lacinia,http://dummyimage.com/128x100.png/ff4444/ffffff,$67.04,food,Stamps
Nike Air Max 90,urna pretium nisl ut volutpat sapien arcu sed augue aliquam erat volutpat,http://dummyimage.com/147x100.png/cc0000/ffffff,$66.48,music,Antiques
Canon EOS Rebel T6,sed magna at nunc commodo placerat praesent blandit nam nulla integer pede justo lacinia eget tincidunt eget tempus vel pede morbi porttitor lorem id ligula suspendisse ornare consequat lectus in est risus auctor sed,http://dummyimage.com/152x100.png/5fa2dd/ffffff,$95.65,books,Paintings
Sony PlayStation 4,vulputate nonummy maecenas tincidunt lacus at velit vivamus vel nulla eget eros elementum pellentesque quisque porta volutpat erat quisque erat eros viverra eget congue eget semper rutrum nulla nunc purus phasellus in felis donec,http://dummyimage.com/122x100.png/dddddd/000000,$55.43,food,Coins
Canon EOS Rebel T6,rhoncus dui vel sem sed sagittis nam congue risus semper porta volutpat quam pede lobortis ligula sit amet eleifend pede libero quis orci nullam molestie nibh in lectus pellentesque at nulla suspendisse potenti cras in purus eu magna vulputate luctus cum sociis natoque penatibus et,http://dummyimage.com/177x100.png/dddddd/000000,$53.54,movies,Antiques
MacBook Pro,ante vel ipsum praesent blandit lacinia erat vestibulum sed magna at nunc commodo placerat praesent blandit nam nulla integer pede justo lacinia eget tincidunt eget tempus vel pede morbi porttitor lorem id ligula suspendisse ornare consequat lectus,http://dummyimage.com/128x100.png/ff4444/ffffff,$74.32,food,Books
Chanel Coco Mademoiselle Perfume,eget elit sodales scelerisque mauris sit amet eros suspendisse accumsan tortor quis turpis sed ante vivamus tortor duis mattis egestas metus aenean fermentum donec ut mauris eget massa tempor,http://dummyimage.com/155x100.png/5fa2dd/ffffff,$36.20,sports,Coins
Amazon Echo Dot,erat volutpat in congue etiam justo etiam pretium iaculis justo in hac,http://dummyimage.com/181x100.png/5fa2dd/ffffff,$64.57,movies,Paintings
Microsoft Surface Pro,blandit nam nulla integer pede justo lacinia eget tincidunt eget tempus vel pede morbi porttitor lorem id ligula suspendisse ornare consequat lectus in est risus auctor sed tristique in tempus sit amet sem fusce consequat nulla nisl nunc nisl duis bibendum felis,http://dummyimage.com/209x100.png/5fa2dd/ffffff,$32.04,movies,Antiques
Microsoft Surface Pro,lectus pellentesque eget nunc donec quis orci eget orci vehicula condimentum curabitur in libero,http://dummyimage.com/192x100.png/cc0000/ffffff,$44.92,music,Books
MacBook Pro,sollicitudin mi sit amet lobortis sapien sapien non mi integer ac neque duis bibendum morbi non quam nec dui luctus rutrum nulla tellus in sagittis dui vel nisl duis ac nibh fusce lacus purus aliquet,http://dummyimage.com/176x100.png/cc0000/ffffff,$15.80,sports,Books
Sony PlayStation 4,integer ac neque duis bibendum morbi non quam nec dui luctus rutrum nulla tellus in sagittis dui vel nisl duis ac nibh fusce lacus purus aliquet at feugiat non pretium quis lectus suspendisse potenti in eleifend quam a odio,http://dummyimage.com/117x100.png/cc0000/ffffff,$94.66,fitness,Stamps
Chanel Coco Mademoiselle Perfume,aliquam convallis nunc proin at turpis a pede posuere nonummy integer non velit donec diam neque vestibulum eget vulputate ut ultrices vel augue vestibulum,http://dummyimage.com/134x100.png/5fa2dd/ffffff,$58.92,sports,Paintings
Canon EOS Rebel T6,faucibus cursus urna ut tellus nulla ut erat id mauris vulputate elementum nullam varius nulla facilisi cras non velit nec nisi vulputate,http://dummyimage.com/200x100.png/ff4444/ffffff,$74.30,technology,Books
Sony PlayStation 4,eget congue eget semper rutrum nulla nunc purus phasellus in felis donec semper sapien a libero nam dui proin leo odio porttitor id consequat in consequat ut nulla sed,http://dummyimage.com/125x100.png/5fa2dd/ffffff,$8.57,food,Paintings
Samsung Galaxy S10,gravida sem praesent id massa id nisl venenatis lacinia aenean sit amet,http://dummyimage.com/107x100.png/cc0000/ffffff,$43.24,fitness,Coins
iPhone X,maecenas pulvinar lobortis est phasellus sit amet erat nulla tempus vivamus in felis eu sapien cursus vestibulum proin eu mi nulla ac enim in tempor turpis nec euismod scelerisque quam,http://dummyimage.com/117x100.png/5fa2dd/ffffff,$91.27,music,Books
Canon EOS Rebel T6,felis donec semper sapien a libero nam dui proin leo odio porttitor id consequat in consequat ut nulla sed accumsan felis ut at dolor quis odio consequat varius integer ac leo pellentesque ultrices mattis odio donec vitae nisi nam ultrices libero non mattis pulvinar,http://dummyimage.com/106x100.png/ff4444/ffffff,$83.94,music,Antiques
Nike Air Max 90,nam dui proin leo odio porttitor id consequat in consequat ut nulla sed accumsan felis ut at dolor quis odio consequat varius integer ac leo pellentesque ultrices mattis odio donec vitae nisi nam ultrices libero non mattis pulvinar nulla pede,http://dummyimage.com/235x100.png/cc0000/ffffff,$91.18,travel,Paintings
MacBook Pro,lacinia erat vestibulum sed magna at nunc commodo placerat praesent blandit nam nulla integer pede justo lacinia eget tincidunt eget tempus vel pede morbi porttitor lorem,http://dummyimage.com/126x100.png/5fa2dd/ffffff,$40.26,fashion,Stamps
Bose QuietComfort 35 II,semper rutrum nulla nunc purus phasellus in felis donec semper sapien a libero nam dui proin leo odio porttitor id consequat in consequat ut nulla sed accumsan felis ut at dolor quis odio consequat varius integer ac leo pellentesque ultrices,http://dummyimage.com/137x100.png/5fa2dd/ffffff,$23.71,technology,Antiques
Microsoft Surface Pro,quis orci nullam molestie nibh in lectus pellentesque at nulla suspendisse potenti cras in purus eu magna vulputate luctus cum sociis natoque penatibus et,http://dummyimage.com/204x100.png/cc0000/ffffff,$49.24,fitness,Antiques
Adidas Ultraboost,donec pharetra magna vestibulum aliquet ultrices erat tortor sollicitudin mi sit amet lobortis,http://dummyimage.com/143x100.png/dddddd/000000,$7.36,art,Antiques
Tiffany & Co. Diamond Necklace,sit amet consectetuer adipiscing elit proin risus praesent lectus vestibulum quam sapien varius ut blandit non interdum in ante vestibulum ante ipsum primis in faucibus orci luctus et ultrices posuere cubilia curae duis faucibus accumsan odio curabitur convallis duis consequat dui nec nisi volutpat eleifend donec ut dolor morbi,http://dummyimage.com/181x100.png/dddddd/000000,$8.59,food,Antiques
Tiffany & Co. Diamond Necklace,nulla dapibus dolor vel est donec odio justo sollicitudin ut suscipit a feugiat et eros vestibulum ac est lacinia nisi venenatis tristique fusce congue diam id ornare imperdiet sapien urna pretium nisl ut volutpat sapien arcu sed augue aliquam erat volutpat in congue etiam justo etiam pretium iaculis justo,http://dummyimage.com/184x100.png/cc0000/ffffff,$14.68,books,Books
Chanel Coco Mademoiselle Perfume,cum sociis natoque penatibus et magnis dis parturient montes nascetur ridiculus mus etiam vel augue vestibulum rutrum rutrum neque aenean auctor gravida sem praesent id massa id nisl venenatis lacinia aenean sit amet justo morbi ut odio cras mi pede malesuada in imperdiet et commodo,http://dummyimage.com/119x100.png/ff4444/ffffff,$41.01,music,Paintings
Dyson V11 Vacuum,proin risus praesent lectus vestibulum quam sapien varius ut blandit non interdum in ante vestibulum ante ipsum primis in faucibus orci luctus et ultrices posuere cubilia curae duis faucibus accumsan odio curabitur convallis duis consequat dui nec nisi,http://dummyimage.com/142x100.png/5fa2dd/ffffff,$78.95,fashion,Coins
Chanel Coco Mademoiselle Perfume,id turpis integer aliquet massa id lobortis convallis tortor risus,http://dummyimage.com/231x100.png/dddddd/000000,$89.44,art,Paintings
Samsung Galaxy S10,metus aenean fermentum donec ut mauris eget massa tempor convallis nulla neque libero convallis eget eleifend luctus ultricies eu nibh quisque id justo sit amet sapien dignissim vestibulum vestibulum ante ipsum primis in,http://dummyimage.com/143x100.png/dddddd/000000,$42.29,fashion,Coins
Rolex Submariner Watch,curabitur convallis duis consequat dui nec nisi volutpat eleifend donec ut dolor morbi vel lectus in quam fringilla rhoncus mauris enim leo rhoncus sed vestibulum sit amet cursus id turpis integer aliquet massa,http://dummyimage.com/222x100.png/cc0000/ffffff,$91.40,music,Books
Amazon Echo Dot,nisi nam ultrices libero non mattis pulvinar nulla pede ullamcorper augue a suscipit nulla elit ac nulla sed vel enim sit amet nunc viverra dapibus,http://dummyimage.com/168x100.png/5fa2dd/ffffff,$44.92,music,Coins
iPhone X,nisl ut volutpat sapien arcu sed augue aliquam erat volutpat in congue etiam justo etiam pretium iaculis justo in hac habitasse platea dictumst etiam faucibus cursus urna ut tellus nulla ut erat id mauris vulputate elementum,http://dummyimage.com/138x100.png/dddddd/000000,$10.08,movies,Books
Gucci GG Marmont Bag,porttitor id consequat in consequat ut nulla sed accumsan felis ut at dolor quis odio consequat varius integer ac leo pellentesque ultrices mattis odio donec vitae nisi nam ultrices libero non mattis pulvinar nulla pede ullamcorper augue a suscipit nulla elit ac nulla sed vel enim sit amet nunc viverra,http://dummyimage.com/166x100.png/cc0000/ffffff,$98.99,technology,Stamps
Adidas Ultraboost,velit eu est congue elementum in hac habitasse platea dictumst morbi vestibulum velit id pretium iaculis diam erat fermentum justo nec condimentum neque sapien placerat ante nulla justo aliquam quis turpis eget elit sodales scelerisque mauris sit amet eros suspendisse accumsan tortor quis turpis sed,http://dummyimage.com/222x100.png/5fa2dd/ffffff,$98.19,technology,Coins
Tiffany & Co. Diamond Necklace,lacus curabitur at ipsum ac tellus semper interdum mauris ullamcorper purus sit amet nulla quisque arcu libero,http://dummyimage.com/207x100.png/cc0000/ffffff,$6.53,books,Stamps
Amazon Echo Dot,nullam sit amet turpis elementum ligula vehicula consequat morbi a ipsum integer a nibh in quis justo maecenas rhoncus aliquam lacus morbi quis tortor id nulla ultrices aliquet maecenas leo odio condimentum,http://dummyimage.com/239x100.png/dddddd/000000,$40.25,art,Antiques
iPhone X,quisque id justo sit amet sapien dignissim vestibulum vestibulum ante ipsum primis in faucibus orci luctus et ultrices posuere cubilia curae nulla dapibus dolor vel est,http://dummyimage.com/219x100.png/dddddd/000000,$40.98,movies,Coins
Nintendo Switch,euismod scelerisque quam turpis adipiscing lorem vitae mattis nibh ligula nec sem duis aliquam convallis nunc proin at turpis a pede posuere nonummy integer non velit,http://dummyimage.com/205x100.png/cc0000/ffffff,$53.54,sports,Antiques
Nintendo Switch,pellentesque ultrices phasellus id sapien in sapien iaculis congue vivamus metus arcu adipiscing molestie hendrerit at vulputate vitae nisl aenean lectus pellentesque eget nunc donec,http://dummyimage.com/141x100.png/ff4444/ffffff,$87.24,fitness,Books
Sony PlayStation 4,quam suspendisse potenti nullam porttitor lacus at turpis donec posuere metus vitae ipsum aliquam non,http://dummyimage.com/239x100.png/cc0000/ffffff,$7.51,books,Antiques
Microsoft Surface Pro,nunc proin at turpis a pede posuere nonummy integer non velit donec diam neque vestibulum eget vulputate ut ultrices vel augue vestibulum ante ipsum primis in faucibus orci luctus et ultrices posuere cubilia curae donec pharetra magna vestibulum aliquet ultrices erat tortor sollicitudin mi sit amet lobortis,http://dummyimage.com/105x100.png/5fa2dd/ffffff,$8.89,travel,Stamps
Rolex Submariner Watch,leo pellentesque ultrices mattis odio donec vitae nisi nam ultrices libero non mattis pulvinar nulla pede ullamcorper augue a suscipit nulla elit ac,http://dummyimage.com/220x100.png/ff4444/ffffff,$31.32,movies,Paintings
MacBook Pro,enim leo rhoncus sed vestibulum sit amet cursus id turpis integer aliquet massa id lobortis convallis tortor risus dapibus augue vel accumsan tellus,http://dummyimage.com/120x100.png/ff4444/ffffff,$97.45,fashion,Coins
Nike Air Max 90,sed interdum venenatis turpis enim blandit mi in porttitor pede justo eu massa donec dapibus duis at velit eu est congue elementum in hac habitasse platea dictumst morbi vestibulum velit id pretium iaculis diam erat fermentum justo nec condimentum neque,http://dummyimage.com/133x100.png/5fa2dd/ffffff,$54.24,fitness,Books
Nike Air Max 90,orci vehicula condimentum curabitur in libero ut massa volutpat convallis morbi odio odio elementum eu interdum eu tincidunt in leo maecenas pulvinar lobortis est phasellus sit amet erat nulla tempus vivamus in felis eu sapien cursus vestibulum proin eu mi,http://dummyimage.com/140x100.png/dddddd/000000,$42.04,technology,Coins
Nintendo Switch,et ultrices posuere cubilia curae duis faucibus accumsan odio curabitur convallis duis consequat dui nec nisi volutpat eleifend donec ut dolor morbi vel lectus in quam fringilla rhoncus mauris enim leo rhoncus sed vestibulum,http://dummyimage.com/216x100.png/ff4444/ffffff,$77.60,books,Paintings
Rolex Submariner Watch,augue a suscipit nulla elit ac nulla sed vel enim sit amet nunc viverra dapibus nulla suscipit ligula in lacus curabitur at ipsum ac tellus semper interdum mauris ullamcorper purus sit amet nulla quisque arcu libero rutrum ac lobortis vel dapibus at,http://dummyimage.com/202x100.png/5fa2dd/ffffff,$61.60,travel,Books
Dyson V11 Vacuum,ultrices phasellus id sapien in sapien iaculis congue vivamus metus arcu adipiscing molestie hendrerit at vulputate vitae nisl aenean lectus pellentesque eget nunc donec quis orci eget orci vehicula condimentum curabitur in libero,http://dummyimage.com/214x100.png/cc0000/ffffff,$15.89,fashion,Stamps
Sony PlayStation 4,nulla ut erat id mauris vulputate elementum nullam varius nulla facilisi cras non velit nec nisi vulputate nonummy maecenas,http://dummyimage.com/139x100.png/dddddd/000000,$46.62,travel,Coins
Gucci GG Marmont Bag,eget vulputate ut ultrices vel augue vestibulum ante ipsum primis in faucibus orci luctus et ultrices posuere cubilia curae donec pharetra magna vestibulum aliquet ultrices erat tortor sollicitudin mi sit amet lobortis,http://dummyimage.com/177x100.png/ff4444/ffffff,$76.90,art,Stamps
MacBook Pro,sodales sed tincidunt eu felis fusce posuere felis sed lacus morbi sem mauris laoreet ut rhoncus aliquet pulvinar sed nisl nunc rhoncus dui vel sem sed sagittis nam congue risus semper porta volutpat quam pede lobortis ligula sit amet eleifend pede libero quis orci nullam molestie nibh in,http://dummyimage.com/101x100.png/5fa2dd/ffffff,$9.48,books,Books
Gucci GG Marmont Bag,erat eros viverra eget congue eget semper rutrum nulla nunc purus phasellus in felis donec semper sapien a libero nam dui proin leo odio porttitor id consequat in consequat ut nulla sed accumsan felis ut at dolor quis odio consequat varius integer ac leo pellentesque ultrices mattis,http://dummyimage.com/240x100.png/5fa2dd/ffffff,$65.45,books,Books
Gucci GG Marmont Bag,mattis pulvinar nulla pede ullamcorper augue a suscipit nulla elit ac nulla sed vel enim sit amet nunc viverra dapibus nulla suscipit ligula in lacus curabitur at ipsum ac tellus semper interdum mauris ullamcorper purus sit amet nulla quisque arcu,http://dummyimage.com/125x100.png/ff4444/ffffff,$93.16,books,Stamps
Gucci GG Marmont Bag,mattis nibh ligula nec sem duis aliquam convallis nunc proin at turpis a pede posuere nonummy integer non velit donec diam neque vestibulum eget vulputate ut ultrices vel augue vestibulum ante ipsum primis in,http://dummyimage.com/230x100.png/dddddd/000000,$82.17,technology,Coins
Canon EOS Rebel T6,magna ac consequat metus sapien ut nunc vestibulum ante ipsum primis in faucibus orci luctus et ultrices posuere cubilia curae mauris viverra diam vitae quam suspendisse potenti nullam porttitor,http://dummyimage.com/177x100.png/dddddd/000000,$73.59,fitness,Stamps
iPhone X,platea dictumst maecenas ut massa quis augue luctus tincidunt nulla mollis molestie lorem quisque ut erat curabitur gravida nisi at,http://dummyimage.com/156x100.png/ff4444/ffffff,$4.61,sports,Coins
Nike Air Max 90,leo pellentesque ultrices mattis odio donec vitae nisi nam ultrices libero non mattis pulvinar nulla pede ullamcorper augue a suscipit nulla elit ac nulla sed vel enim sit amet nunc viverra dapibus nulla suscipit ligula in,http://dummyimage.com/220x100.png/dddddd/000000,$31.17,books,Stamps
Nike Air Max 90,mus etiam vel augue vestibulum rutrum rutrum neque aenean auctor gravida sem praesent id massa id nisl,http://dummyimage.com/121x100.png/5fa2dd/ffffff,$18.58,sports,Antiques
iPhone X,leo rhoncus sed vestibulum sit amet cursus id turpis integer aliquet massa id lobortis convallis tortor risus dapibus augue vel accumsan tellus nisi eu orci mauris lacinia,http://dummyimage.com/204x100.png/cc0000/ffffff,$64.17,art,Stamps
Lego Star Wars Millennium Falcon,purus aliquet at feugiat non pretium quis lectus suspendisse potenti in eleifend quam a odio in hac habitasse platea dictumst maecenas ut massa quis augue luctus,http://dummyimage.com/129x100.png/cc0000/ffffff,$88.53,fitness,Paintings
Bose QuietComfort 35 II,tristique fusce congue diam id ornare imperdiet sapien urna pretium nisl ut volutpat sapien arcu sed augue aliquam erat volutpat in congue etiam justo etiam pretium iaculis justo in hac habitasse platea dictumst etiam faucibus cursus urna,http://dummyimage.com/151x100.png/ff4444/ffffff,$82.74,food,Antiques
Bose QuietComfort 35 II,lacinia erat vestibulum sed magna at nunc commodo placerat praesent blandit nam nulla integer pede justo lacinia eget tincidunt eget tempus vel pede morbi porttitor lorem id ligula suspendisse ornare consequat lectus in est risus auctor,http://dummyimage.com/149x100.png/5fa2dd/ffffff,$89.87,fitness,Books
Tiffany & Co. Diamond Necklace,ut suscipit a feugiat et eros vestibulum ac est lacinia nisi venenatis tristique fusce congue diam id ornare imperdiet sapien urna pretium nisl ut volutpat sapien arcu sed augue aliquam erat volutpat in congue etiam justo etiam pretium iaculis justo,http://dummyimage.com/221x100.png/dddddd/000000,$22.22,sports,Stamps
GoPro Hero 7,justo aliquam quis turpis eget elit sodales scelerisque mauris sit amet eros suspendisse accumsan tortor quis turpis sed ante vivamus tortor duis mattis egestas metus aenean fermentum donec ut mauris eget massa,http://dummyimage.com/182x100.png/ff4444/ffffff,$66.33,sports,Books
GoPro Hero 7,consectetuer adipiscing elit proin risus praesent lectus vestibulum quam sapien varius ut blandit non interdum in ante vestibulum ante ipsum primis in faucibus orci luctus et ultrices posuere cubilia curae duis faucibus accumsan odio curabitur convallis duis consequat,http://dummyimage.com/211x100.png/5fa2dd/ffffff,$4.34,books,Stamps
Bose QuietComfort 35 II,nunc rhoncus dui vel sem sed sagittis nam congue risus semper porta volutpat quam pede lobortis ligula sit amet eleifend pede libero quis orci nullam,http://dummyimage.com/214x100.png/ff4444/ffffff,$93.64,fashion,Stamps
Fitbit Charge 3,sapien ut nunc vestibulum ante ipsum primis in faucibus orci luctus et ultrices posuere cubilia curae mauris viverra diam,http://dummyimage.com/217x100.png/ff4444/ffffff,$50.17,food,Books
Nintendo Switch,tristique fusce congue diam id ornare imperdiet sapien urna pretium nisl ut volutpat sapien arcu sed augue aliquam erat volutpat in congue etiam justo etiam pretium iaculis justo in hac habitasse platea dictumst etiam faucibus cursus urna ut tellus,http://dummyimage.com/154x100.png/ff4444/ffffff,$74.45,technology,Coins
Sony PlayStation 4,porta volutpat quam pede lobortis ligula sit amet eleifend pede libero quis orci nullam molestie nibh in lectus,http://dummyimage.com/232x100.png/dddddd/000000,$11.80,music,Books
Nike Air Max 90,vulputate luctus cum sociis natoque penatibus et magnis dis parturient montes nascetur ridiculus mus vivamus vestibulum sagittis sapien cum sociis natoque penatibus et magnis dis parturient montes nascetur ridiculus mus etiam vel augue vestibulum rutrum rutrum neque aenean auctor gravida sem praesent id massa id nisl venenatis,http://dummyimage.com/223x100.png/ff4444/ffffff,$34.64,fitness,Paintings
GoPro Hero 7,nibh in quis justo maecenas rhoncus aliquam lacus morbi quis tortor id nulla ultrices aliquet maecenas leo odio condimentum id luctus nec molestie sed justo pellentesque viverra pede ac diam cras pellentesque volutpat dui maecenas tristique est et,http://dummyimage.com/211x100.png/ff4444/ffffff,$80.03,fitness,Paintings
Chanel Coco Mademoiselle Perfume,faucibus orci luctus et ultrices posuere cubilia curae donec pharetra magna vestibulum aliquet ultrices erat tortor sollicitudin mi sit amet lobortis sapien sapien non mi integer ac neque duis bibendum morbi non quam nec dui luctus rutrum nulla tellus,http://dummyimage.com/149x100.png/dddddd/000000,$56.02,fitness,Stamps
Amazon Echo Dot,morbi porttitor lorem id ligula suspendisse ornare consequat lectus in est risus auctor sed tristique in tempus sit amet sem fusce consequat nulla nisl nunc nisl duis bibendum,http://dummyimage.com/171x100.png/5fa2dd/ffffff,$44.07,movies,Antiques
Tiffany & Co. Diamond Necklace,varius ut blandit non interdum in ante vestibulum ante ipsum primis in faucibus orci luctus et ultrices posuere cubilia curae duis faucibus accumsan odio curabitur convallis duis consequat dui nec nisi volutpat eleifend donec ut dolor morbi vel lectus in quam fringilla rhoncus mauris enim leo rhoncus sed,http://dummyimage.com/180x100.png/5fa2dd/ffffff,$42.36,food,Antiques
Amazon Echo Dot,nulla dapibus dolor vel est donec odio justo sollicitudin ut suscipit a feugiat et eros vestibulum ac est lacinia nisi venenatis tristique fusce congue diam id ornare imperdiet sapien urna pretium nisl ut volutpat sapien arcu sed augue aliquam,http://dummyimage.com/117x100.png/dddddd/000000,$67.72,fitness,Stamps
Tiffany & Co. Diamond Necklace,hac habitasse platea dictumst aliquam augue quam sollicitudin vitae consectetuer eget,http://dummyimage.com/235x100.png/ff4444/ffffff,$93.99,travel,Books
Adidas Ultraboost,morbi odio odio elementum eu interdum eu tincidunt in leo maecenas pulvinar lobortis est phasellus sit amet erat nulla tempus vivamus,http://dummyimage.com/223x100.png/cc0000/ffffff,$0.53,food,Coins
Bose QuietComfort 35 II,a suscipit nulla elit ac nulla sed vel enim sit amet nunc,http://dummyimage.com/136x100.png/5fa2dd/ffffff,$40.28,sports,Paintings
Canon EOS Rebel T6,praesent blandit nam nulla integer pede justo lacinia eget tincidunt eget tempus vel pede morbi porttitor,http://dummyimage.com/157x100.png/ff4444/ffffff,$49.12,books,Stamps
Dyson V11 Vacuum,at feugiat non pretium quis lectus suspendisse potenti in eleifend quam a odio in hac habitasse platea dictumst maecenas ut massa quis augue luctus tincidunt nulla mollis molestie lorem quisque ut erat curabitur gravida nisi at nibh in hac habitasse platea dictumst aliquam augue quam,http://dummyimage.com/140x100.png/5fa2dd/ffffff,$79.22,food,Books
Tiffany & Co. Diamond Necklace,arcu adipiscing molestie hendrerit at vulputate vitae nisl aenean lectus pellentesque eget nunc donec quis orci eget orci vehicula condimentum curabitur in libero ut massa volutpat convallis morbi odio odio elementum eu interdum eu tincidunt in,http://dummyimage.com/106x100.png/dddddd/000000,$0.72,movies,Paintings
iPhone X,cras mi pede malesuada in imperdiet et commodo vulputate justo in blandit ultrices enim lorem ipsum dolor sit amet,http://dummyimage.com/221x100.png/ff4444/ffffff,$52.80,travel,Paintings
Adidas Ultraboost,vestibulum vestibulum ante ipsum primis in faucibus orci luctus et ultrices posuere cubilia curae nulla dapibus dolor vel est donec odio justo sollicitudin ut suscipit a feugiat et eros vestibulum ac,http://dummyimage.com/105x100.png/cc0000/ffffff,$22.92,fitness,Antiques
