Title,Description,Media,Price,Tags,Collection
Samsung Galaxy S10,vestibulum ante ipsum primis in faucibus orci luctus et ultrices posuere cubilia curae mauris viverra diam vitae quam suspendisse potenti nullam porttitor lacus at turpis donec posuere metus vitae ipsum aliquam non mauris morbi non lectus aliquam sit amet diam in magna bibendum imperdiet nullam orci pede venenatis,http://dummyimage.com/147x100.png/dddddd/000000,$51.31,fitness,Antiques
Bose QuietComfort 35 II,penatibus et magnis dis parturient montes nascetur ridiculus mus etiam vel augue vestibulum rutrum rutrum neque aenean auctor gravida sem praesent id massa id nisl venenatis lacinia aenean sit amet justo morbi ut odio cras mi pede malesuada in imperdiet et commodo vulputate justo in blandit ultrices enim,http://dummyimage.com/224x100.png/ff4444/ffffff,$58.00,fashion,Antiques
Bose QuietComfort 35 II,mauris vulputate elementum nullam varius nulla facilisi cras non velit nec nisi vulputate nonummy maecenas tincidunt,http://dummyimage.com/105x100.png/dddddd/000000,$78.20,technology,Stamps
Nike Air Max 90,convallis eget eleifend luctus ultricies eu nibh quisque id justo sit amet sapien dignissim vestibulum vestibulum ante ipsum primis in faucibus orci luctus et ultrices posuere cubilia curae nulla dapibus dolor vel est donec odio justo,http://dummyimage.com/224x100.png/ff4444/ffffff,$9.22,books,Paintings
Chanel Coco Mademoiselle Perfume,orci luctus et ultrices posuere cubilia curae nulla dapibus dolor vel est donec odio justo sollicitudin ut suscipit a feugiat et eros vestibulum ac est lacinia nisi venenatis tristique fusce congue diam id ornare imperdiet sapien urna pretium nisl,http://dummyimage.com/245x100.png/dddddd/000000,$40.17,movies,Books
Dyson V11 Vacuum,ligula suspendisse ornare consequat lectus in est risus auctor sed tristique in tempus sit amet sem fusce consequat nulla nisl nunc,http://dummyimage.com/102x100.png/ff4444/ffffff,$15.20,music,Paintings
Microsoft Surface Pro,orci luctus et ultrices posuere cubilia curae duis faucibus accumsan odio curabitur convallis duis consequat dui nec nisi volutpat eleifend donec ut dolor morbi vel lectus in quam fringilla rhoncus mauris enim leo rhoncus sed vestibulum sit amet cursus id turpis,http://dummyimage.com/239x100.png/5fa2dd/ffffff,$15.65,travel,Stamps
Fitbit Charge 3,et tempus semper est quam pharetra magna ac consequat metus sapien ut nunc vestibulum ante ipsum primis,http://dummyimage.com/140x100.png/dddddd/000000,$60.77,food,Coins
Amazon Echo Dot,mauris morbi non lectus aliquam sit amet diam in magna bibendum imperdiet nullam orci,http://dummyimage.com/100x100.png/ff4444/ffffff,$9.54,books,Stamps
MacBook Pro,curabitur convallis duis consequat dui nec nisi volutpat eleifend donec ut dolor morbi vel lectus in quam fringilla rhoncus mauris enim leo rhoncus sed vestibulum sit amet cursus id turpis integer aliquet massa id lobortis convallis tortor risus dapibus augue vel,http://dummyimage.com/179x100.png/dddddd/000000,$63.27,movies,Paintings
Lego Star Wars Millennium Falcon,lobortis convallis tortor risus dapibus augue vel accumsan tellus nisi eu orci mauris lacinia sapien quis libero nullam sit amet turpis elementum ligula vehicula consequat morbi a ipsum integer,http://dummyimage.com/143x100.png/dddddd/000000,$49.90,food,Stamps
Microsoft Surface Pro,id turpis integer aliquet massa id lobortis convallis tortor risus dapibus augue vel accumsan tellus nisi eu orci mauris lacinia sapien quis libero nullam sit amet turpis elementum ligula vehicula consequat morbi a ipsum integer a nibh in quis justo maecenas rhoncus aliquam lacus morbi quis,http://dummyimage.com/181x100.png/dddddd/000000,$47.20,art,Stamps
Canon EOS Rebel T6,sed justo pellentesque viverra pede ac diam cras pellentesque volutpat dui maecenas tristique est et tempus semper est quam pharetra magna ac consequat metus sapien ut nunc vestibulum ante ipsum primis in faucibus orci luctus et ultrices posuere cubilia curae mauris viverra diam vitae quam,http://dummyimage.com/205x100.png/ff4444/ffffff,$34.75,travel,Antiques
Amazon Echo Dot,nulla sed vel enim sit amet nunc viverra dapibus nulla,http://dummyimage.com/175x100.png/5fa2dd/ffffff,$29.92,technology,Books
Bose QuietComfort 35 II,ornare imperdiet sapien urna pretium nisl ut volutpat sapien arcu sed augue aliquam erat volutpat,http://dummyimage.com/170x100.png/ff4444/ffffff,$99.59,fashion,Paintings
Canon EOS Rebel T6,in faucibus orci luctus et ultrices posuere cubilia curae donec pharetra magna vestibulum aliquet ultrices erat tortor sollicitudin mi sit amet,http://dummyimage.com/127x100.png/ff4444/ffffff,$44.55,fashion,Books
Lego Star Wars Millennium Falcon,ante ipsum primis in faucibus orci luctus et ultrices posuere cubilia curae duis faucibus accumsan odio curabitur convallis duis consequat dui nec nisi volutpat eleifend donec ut dolor morbi vel lectus in quam fringilla rhoncus mauris enim leo rhoncus,http://dummyimage.com/199x100.png/ff4444/ffffff,$9.07,fashion,Stamps
Chanel Coco Mademoiselle Perfume,maecenas leo odio condimentum id luctus nec molestie sed justo pellentesque viverra pede ac diam cras pellentesque volutpat dui maecenas tristique est et tempus semper est quam pharetra magna ac consequat metus sapien ut nunc vestibulum ante ipsum primis in faucibus orci luctus et ultrices posuere cubilia curae mauris viverra,http://dummyimage.com/242x100.png/5fa2dd/ffffff,$91.61,travel,Stamps
Nike Air Max 90,congue diam id ornare imperdiet sapien urna pretium nisl ut volutpat sapien arcu sed augue aliquam erat volutpat in congue etiam justo etiam,http://dummyimage.com/236x100.png/dddddd/000000,$88.54,food,Paintings
GoPro Hero 7,ac enim in tempor turpis nec euismod scelerisque quam turpis adipiscing lorem vitae mattis nibh ligula nec sem,http://dummyimage.com/101x100.png/5fa2dd/ffffff,$0.16,technology,Antiques
Fitbit Charge 3,tempor convallis nulla neque libero convallis eget eleifend luctus ultricies eu nibh quisque id justo sit amet sapien dignissim vestibulum vestibulum ante ipsum primis in faucibus orci luctus et ultrices posuere cubilia curae nulla dapibus dolor vel,http://dummyimage.com/229x100.png/dddddd/000000,$40.30,fitness,Books
Samsung Galaxy S10,mattis egestas metus aenean fermentum donec ut mauris eget massa tempor convallis nulla neque libero convallis eget eleifend luctus ultricies eu nibh quisque id justo sit amet sapien dignissim vestibulum vestibulum ante ipsum,http://dummyimage.com/150x100.png/dddddd/000000,$1.05,books,Stamps
Microsoft Surface Pro,pellentesque at nulla suspendisse potenti cras in purus eu magna vulputate luctus cum sociis natoque penatibus et magnis dis parturient montes nascetur ridiculus mus vivamus vestibulum,http://dummyimage.com/153x100.png/dddddd/000000,$58.89,fitness,Books
Adidas Ultraboost,sed justo pellentesque viverra pede ac diam cras pellentesque volutpat dui maecenas tristique est et tempus semper est quam pharetra magna ac consequat metus sapien ut nunc vestibulum ante ipsum primis in faucibus orci luctus et ultrices posuere cubilia curae mauris viverra diam vitae quam suspendisse potenti nullam porttitor,http://dummyimage.com/117x100.png/ff4444/ffffff,$85.36,art,Books
iPhone X,laoreet ut rhoncus aliquet pulvinar sed nisl nunc rhoncus dui vel,http://dummyimage.com/172x100.png/dddddd/000000,$60.45,fitness,Paintings
Fitbit Charge 3,pede ullamcorper augue a suscipit nulla elit ac nulla sed vel enim sit amet nunc viverra dapibus nulla suscipit ligula in lacus curabitur at ipsum ac tellus semper interdum mauris ullamcorper purus sit amet nulla quisque arcu libero rutrum ac lobortis vel dapibus at diam nam tristique tortor eu,http://dummyimage.com/141x100.png/dddddd/000000,$44.73,fitness,Books
Adidas Ultraboost,semper porta volutpat quam pede lobortis ligula sit amet eleifend pede libero quis,http://dummyimage.com/101x100.png/cc0000/ffffff,$68.53,sports,Coins
Dyson V11 Vacuum,nulla pede ullamcorper augue a suscipit nulla elit ac nulla sed vel enim sit amet nunc viverra dapibus nulla suscipit ligula in lacus curabitur at ipsum ac tellus semper interdum mauris ullamcorper purus sit amet nulla quisque arcu libero rutrum ac,http://dummyimage.com/183x100.png/dddddd/000000,$44.92,sports,Stamps
Gucci GG Marmont Bag,justo pellentesque viverra pede ac diam cras pellentesque volutpat dui maecenas tristique est et tempus semper est quam pharetra magna ac consequat metus sapien ut nunc vestibulum ante ipsum primis in faucibus orci luctus et ultrices posuere cubilia curae,http://dummyimage.com/155x100.png/5fa2dd/ffffff,$39.67,fitness,Stamps
Rolex Submariner Watch,pharetra magna ac consequat metus sapien ut nunc vestibulum ante ipsum primis in faucibus orci luctus et ultrices posuere cubilia curae,http://dummyimage.com/125x100.png/5fa2dd/ffffff,$48.44,fitness,Antiques
Nike Air Max 90,elementum pellentesque quisque porta volutpat erat quisque erat eros viverra eget congue eget semper,http://dummyimage.com/227x100.png/cc0000/ffffff,$3.26,music,Paintings
Nintendo Switch,massa id nisl venenatis lacinia aenean sit amet justo morbi ut odio cras mi pede malesuada in imperdiet et commodo vulputate justo in blandit ultrices enim lorem ipsum dolor sit amet consectetuer adipiscing elit proin interdum mauris,http://dummyimage.com/159x100.png/ff4444/ffffff,$9.90,art,Coins
Gucci GG Marmont Bag,eget congue eget semper rutrum nulla nunc purus phasellus in felis donec semper sapien a libero nam dui proin,http://dummyimage.com/213x100.png/ff4444/ffffff,$21.04,art,Books
GoPro Hero 7,erat quisque erat eros viverra eget congue eget semper rutrum nulla nunc purus phasellus in felis donec semper sapien a libero nam dui,http://dummyimage.com/115x100.png/5fa2dd/ffffff,$45.23,movies,Stamps
MacBook Pro,sit amet lobortis sapien sapien non mi integer ac neque duis bibendum morbi non quam nec dui luctus rutrum nulla tellus in sagittis dui vel nisl duis ac nibh fusce lacus purus aliquet at,http://dummyimage.com/156x100.png/dddddd/000000,$4.59,fitness,Stamps
Fitbit Charge 3,vel enim sit amet nunc viverra dapibus nulla suscipit ligula in lacus curabitur at ipsum ac tellus semper interdum mauris ullamcorper purus sit amet nulla quisque arcu libero rutrum ac lobortis vel dapibus at diam nam,http://dummyimage.com/112x100.png/ff4444/ffffff,$1.27,art,Books
Tiffany & Co. Diamond Necklace,vulputate justo in blandit ultrices enim lorem ipsum dolor sit amet consectetuer adipiscing elit proin interdum mauris non ligula pellentesque ultrices phasellus id sapien in sapien iaculis congue vivamus metus arcu adipiscing molestie hendrerit at vulputate vitae nisl aenean lectus pellentesque eget nunc donec quis orci eget orci,http://dummyimage.com/125x100.png/cc0000/ffffff,$14.11,movies,Paintings
Gucci GG Marmont Bag,massa volutpat convallis morbi odio odio elementum eu interdum eu tincidunt in leo maecenas pulvinar lobortis est phasellus sit amet erat nulla tempus vivamus in felis eu sapien cursus vestibulum proin eu mi nulla ac enim in tempor turpis,http://dummyimage.com/246x100.png/5fa2dd/ffffff,$60.49,fashion,Stamps
Nike Air Max 90,mauris viverra diam vitae quam suspendisse potenti nullam porttitor lacus at turpis donec posuere metus vitae ipsum aliquam non mauris morbi non lectus aliquam sit amet diam in magna bibendum imperdiet nullam orci pede venenatis non sodales sed tincidunt eu felis fusce posuere felis sed lacus morbi sem mauris laoreet,http://dummyimage.com/188x100.png/ff4444/ffffff,$55.16,fashion,Paintings
Dyson V11 Vacuum,massa quis augue luctus tincidunt nulla mollis molestie lorem quisque ut erat curabitur gravida nisi at nibh in hac habitasse platea dictumst aliquam augue quam sollicitudin vitae consectetuer eget rutrum at lorem integer tincidunt ante vel ipsum praesent blandit lacinia erat vestibulum sed magna at nunc commodo placerat praesent blandit,http://dummyimage.com/225x100.png/cc0000/ffffff,$67.58,movies,Antiques
Amazon Echo Dot,scelerisque mauris sit amet eros suspendisse accumsan tortor quis turpis sed ante vivamus tortor duis mattis egestas metus aenean fermentum donec ut mauris eget massa tempor convallis nulla neque libero convallis eget eleifend luctus ultricies eu nibh quisque id justo sit amet sapien dignissim,http://dummyimage.com/205x100.png/ff4444/ffffff,$79.16,music,Stamps
Lego Star Wars Millennium Falcon,ridiculus mus etiam vel augue vestibulum rutrum rutrum neque aenean auctor gravida sem praesent id massa id nisl venenatis lacinia aenean sit amet justo morbi ut odio cras mi pede malesuada in imperdiet et commodo vulputate justo in blandit,http://dummyimage.com/232x100.png/dddddd/000000,$10.38,movies,Antiques
GoPro Hero 7,dictumst morbi vestibulum velit id pretium iaculis diam erat fermentum justo nec condimentum neque sapien placerat ante nulla justo aliquam quis turpis eget elit sodales scelerisque mauris sit amet eros suspendisse accumsan tortor quis turpis sed ante vivamus tortor duis mattis,http://dummyimage.com/227x100.png/dddddd/000000,$75.85,art,Antiques
Samsung Galaxy S10,posuere felis sed lacus morbi sem mauris laoreet ut rhoncus aliquet pulvinar sed nisl nunc rhoncus dui vel sem sed sagittis nam congue risus semper porta volutpat quam pede lobortis ligula sit amet eleifend pede libero quis orci,http://dummyimage.com/180x100.png/dddddd/000000,$26.13,food,Coins
GoPro Hero 7,scelerisque mauris sit amet eros suspendisse accumsan tortor quis turpis sed ante vivamus tortor duis mattis egestas metus aenean fermentum donec ut mauris eget massa tempor convallis nulla neque libero convallis eget eleifend luctus ultricies eu nibh quisque id justo sit amet sapien dignissim vestibulum vestibulum,http://dummyimage.com/175x100.png/dddddd/000000,$70.14,travel,Coins
iPhone X,et commodo vulputate justo in blandit ultrices enim lorem ipsum dolor sit amet consectetuer adipiscing elit proin interdum mauris non ligula pellentesque ultrices phasellus id sapien in sapien iaculis congue vivamus metus arcu adipiscing molestie hendrerit at vulputate vitae nisl aenean lectus pellentesque eget nunc donec quis orci,http://dummyimage.com/147x100.png/5fa2dd/ffffff,$75.30,food,Coins
GoPro Hero 7,nisi volutpat eleifend donec ut dolor morbi vel lectus in quam fringilla rhoncus mauris enim leo rhoncus sed vestibulum sit amet cursus id turpis integer aliquet massa id lobortis convallis tortor risus dapibus augue,http://dummyimage.com/127x100.png/5fa2dd/ffffff,$34.27,music,Antiques
Nintendo Switch,sagittis nam congue risus semper porta volutpat quam pede lobortis ligula sit amet eleifend pede libero quis orci nullam molestie nibh in lectus pellentesque at nulla suspendisse potenti cras in purus eu,http://dummyimage.com/124x100.png/ff4444/ffffff,$50.31,fitness,Stamps
iPhone X,diam cras pellentesque volutpat dui maecenas tristique est et tempus semper est quam pharetra magna ac consequat metus sapien ut nunc vestibulum ante ipsum primis in faucibus orci luctus et ultrices posuere cubilia,http://dummyimage.com/124x100.png/dddddd/000000,$81.40,movies,Books
Amazon Echo Dot,amet cursus id turpis integer aliquet massa id lobortis convallis tortor risus dapibus augue vel accumsan tellus nisi eu orci mauris lacinia sapien quis libero nullam sit amet turpis elementum ligula vehicula consequat morbi a ipsum,http://dummyimage.com/241x100.png/ff4444/ffffff,$83.12,food,Paintings
Louis Vuitton Neverfull Tote,molestie sed justo pellentesque viverra pede ac diam cras pellentesque volutpat dui maecenas tristique est et tempus semper est quam pharetra magna ac consequat metus sapien ut nunc vestibulum ante ipsum primis in faucibus orci luctus et ultrices posuere cubilia curae mauris viverra diam,http://dummyimage.com/205x100.png/ff4444/ffffff,$18.30,books,Stamps
Sony PlayStation 4,lobortis convallis tortor risus dapibus augue vel accumsan tellus nisi eu orci mauris lacinia sapien quis libero nullam sit amet turpis elementum ligula vehicula consequat morbi a ipsum integer,http://dummyimage.com/112x100.png/cc0000/ffffff,$42.20,travel,Antiques
GoPro Hero 7,pede justo eu massa donec dapibus duis at velit eu est congue elementum in hac habitasse platea dictumst morbi vestibulum velit id pretium iaculis diam erat fermentum justo nec condimentum neque sapien placerat ante nulla justo aliquam quis turpis eget elit sodales scelerisque mauris sit,http://dummyimage.com/137x100.png/dddddd/000000,$28.27,fashion,Coins
Lego Star Wars Millennium Falcon,in hac habitasse platea dictumst etiam faucibus cursus urna ut tellus nulla ut erat id mauris vulputate elementum nullam varius nulla facilisi cras non velit nec nisi vulputate nonummy maecenas tincidunt lacus at velit,http://dummyimage.com/235x100.png/5fa2dd/ffffff,$34.57,movies,Antiques
Lego Star Wars Millennium Falcon,montes nascetur ridiculus mus vivamus vestibulum sagittis sapien cum sociis natoque penatibus et magnis dis parturient montes nascetur ridiculus mus etiam vel augue vestibulum rutrum rutrum neque,http://dummyimage.com/190x100.png/dddddd/000000,$16.88,fashion,Stamps
MacBook Pro,et commodo vulputate justo in blandit ultrices enim lorem ipsum dolor sit amet,http://dummyimage.com/137x100.png/5fa2dd/ffffff,$31.35,books,Books
Sony PlayStation 4,libero convallis eget eleifend luctus ultricies eu nibh quisque id justo sit amet sapien dignissim vestibulum vestibulum ante ipsum primis in faucibus orci luctus et ultrices posuere cubilia curae,http://dummyimage.com/143x100.png/cc0000/ffffff,$68.51,travel,Paintings
GoPro Hero 7,etiam faucibus cursus urna ut tellus nulla ut erat id mauris vulputate elementum nullam varius nulla facilisi cras,http://dummyimage.com/205x100.png/5fa2dd/ffffff,$31.53,fitness,Antiques
Canon EOS Rebel T6,pharetra magna ac consequat metus sapien ut nunc vestibulum ante ipsum primis in faucibus orci luctus et ultrices posuere cubilia curae mauris viverra diam vitae quam suspendisse potenti nullam porttitor lacus at turpis,http://dummyimage.com/214x100.png/cc0000/ffffff,$38.26,movies,Books
iPhone X,mattis odio donec vitae nisi nam ultrices libero non mattis pulvinar nulla pede ullamcorper augue a suscipit nulla elit ac nulla sed,http://dummyimage.com/135x100.png/cc0000/ffffff,$98.70,sports,Antiques
Canon EOS Rebel T6,luctus et ultrices posuere cubilia curae mauris viverra diam vitae quam suspendisse potenti nullam porttitor lacus at turpis donec posuere,http://dummyimage.com/248x100.png/5fa2dd/ffffff,$41.85,travel,Coins
Nintendo Switch,orci pede venenatis non sodales sed tincidunt eu felis fusce posuere felis sed lacus morbi sem mauris laoreet ut rhoncus aliquet pulvinar sed nisl nunc rhoncus dui vel sem sed sagittis nam congue risus semper porta volutpat quam,http://dummyimage.com/175x100.png/5fa2dd/ffffff,$97.70,sports,Books
Bose QuietComfort 35 II,tortor risus dapibus augue vel accumsan tellus nisi eu orci mauris lacinia sapien quis libero nullam sit,http://dummyimage.com/137x100.png/dddddd/000000,$36.05,music,Coins
Lego Star Wars Millennium Falcon,aliquam convallis nunc proin at turpis a pede posuere nonummy integer non velit donec diam neque vestibulum eget vulputate ut ultrices vel augue vestibulum ante ipsum primis in faucibus orci luctus et ultrices posuere,http://dummyimage.com/231x100.png/5fa2dd/ffffff,$32.76,movies,Paintings
Louis Vuitton Neverfull Tote,potenti nullam porttitor lacus at turpis donec posuere metus vitae ipsum aliquam non mauris,http://dummyimage.com/172x100.png/dddddd/000000,$64.38,fashion,Antiques
Gucci GG Marmont Bag,cubilia curae donec pharetra magna vestibulum aliquet ultrices erat tortor sollicitudin mi sit amet,http://dummyimage.com/150x100.png/dddddd/000000,$26.83,music,Stamps
Tiffany & Co. Diamond Necklace,interdum in ante vestibulum ante ipsum primis in faucibus orci luctus et ultrices posuere cubilia curae duis faucibus accumsan odio curabitur convallis duis,http://dummyimage.com/178x100.png/dddddd/000000,$11.07,movies,Paintings
MacBook Pro,est congue elementum in hac habitasse platea dictumst morbi vestibulum velit id pretium iaculis diam erat fermentum justo nec condimentum neque sapien placerat ante nulla justo aliquam quis turpis eget elit sodales scelerisque mauris sit amet,http://dummyimage.com/129x100.png/ff4444/ffffff,$37.13,music,Books
Rolex Submariner Watch,erat tortor sollicitudin mi sit amet lobortis sapien sapien non mi integer ac neque duis bibendum morbi non quam nec dui luctus,http://dummyimage.com/175x100.png/5fa2dd/ffffff,$7.33,fashion,Paintings
Sony PlayStation 4,vulputate justo in blandit ultrices enim lorem ipsum dolor sit amet consectetuer adipiscing elit proin interdum mauris,http://dummyimage.com/245x100.png/ff4444/ffffff,$17.58,sports,Books
Louis Vuitton Neverfull Tote,hac habitasse platea dictumst aliquam augue quam sollicitudin vitae consectetuer eget rutrum at lorem integer tincidunt ante vel ipsum praesent blandit lacinia erat vestibulum sed magna at nunc commodo placerat praesent,http://dummyimage.com/240x100.png/cc0000/ffffff,$51.80,fashion,Coins
GoPro Hero 7,mattis odio donec vitae nisi nam ultrices libero non mattis pulvinar nulla pede ullamcorper augue a suscipit nulla elit ac nulla sed vel enim sit amet nunc viverra dapibus nulla suscipit ligula in lacus curabitur at ipsum ac tellus semper interdum mauris ullamcorper purus sit amet nulla quisque,http://dummyimage.com/205x100.png/dddddd/000000,$66.00,sports,Stamps
Chanel Coco Mademoiselle Perfume,tincidunt lacus at velit vivamus vel nulla eget eros elementum pellentesque quisque porta volutpat erat quisque erat eros viverra eget congue eget semper rutrum nulla nunc purus phasellus in,http://dummyimage.com/211x100.png/dddddd/000000,$50.07,technology,Stamps
Lego Star Wars Millennium Falcon,cubilia curae mauris viverra diam vitae quam suspendisse potenti nullam porttitor lacus at turpis donec posuere metus vitae ipsum aliquam non mauris morbi non lectus aliquam sit amet diam in magna bibendum imperdiet nullam orci pede venenatis non sodales,http://dummyimage.com/148x100.png/5fa2dd/ffffff,$69.45,music,Paintings
Samsung Galaxy S10,ut nunc vestibulum ante ipsum primis in faucibus orci luctus et ultrices posuere cubilia curae mauris viverra diam vitae quam suspendisse potenti nullam porttitor lacus at turpis donec posuere metus vitae ipsum aliquam non mauris morbi,http://dummyimage.com/131x100.png/ff4444/ffffff,$84.78,art,Antiques
Dyson V11 Vacuum,suspendisse potenti nullam porttitor lacus at turpis donec posuere metus vitae ipsum aliquam non mauris morbi non lectus aliquam sit amet diam in,http://dummyimage.com/107x100.png/5fa2dd/ffffff,$41.37,music,Antiques
Louis Vuitton Neverfull Tote,sit amet turpis elementum ligula vehicula consequat morbi a ipsum integer a nibh in quis justo maecenas rhoncus aliquam lacus morbi quis tortor id nulla ultrices aliquet maecenas leo,http://dummyimage.com/156x100.png/cc0000/ffffff,$6.68,sports,Books
Fitbit Charge 3,erat eros viverra eget congue eget semper rutrum nulla nunc purus phasellus in felis donec semper,http://dummyimage.com/192x100.png/dddddd/000000,$48.00,books,Antiques
Fitbit Charge 3,mauris eget massa tempor convallis nulla neque libero convallis eget eleifend luctus ultricies eu nibh quisque id justo sit amet sapien dignissim vestibulum vestibulum ante ipsum primis in faucibus orci luctus et ultrices posuere cubilia curae nulla dapibus dolor vel est donec odio justo sollicitudin ut suscipit,http://dummyimage.com/225x100.png/5fa2dd/ffffff,$55.18,sports,Antiques
Sony PlayStation 4,odio porttitor id consequat in consequat ut nulla sed accumsan felis ut at dolor quis odio consequat varius integer ac leo pellentesque ultrices mattis odio donec vitae nisi nam ultrices libero non mattis pulvinar nulla pede ullamcorper augue a suscipit nulla elit ac nulla,http://dummyimage.com/211x100.png/cc0000/ffffff,$68.40,food,Stamps
Samsung Galaxy S10,nam congue risus semper porta volutpat quam pede lobortis ligula sit amet eleifend pede libero quis orci nullam molestie nibh in lectus pellentesque at nulla suspendisse potenti cras in purus eu magna vulputate,http://dummyimage.com/225x100.png/dddddd/000000,$39.29,fashion,Coins
Sony PlayStation 4,pede libero quis orci nullam molestie nibh in lectus pellentesque at nulla suspendisse potenti cras in purus eu magna vulputate luctus cum sociis natoque penatibus et,http://dummyimage.com/113x100.png/5fa2dd/ffffff,$22.84,books,Books
Tiffany & Co. Diamond Necklace,volutpat in congue etiam justo etiam pretium iaculis justo in hac habitasse platea dictumst etiam faucibus cursus urna ut tellus nulla ut erat,http://dummyimage.com/103x100.png/dddddd/000000,$77.81,fitness,Coins
iPhone X,ipsum praesent blandit lacinia erat vestibulum sed magna at nunc commodo placerat praesent blandit nam nulla integer pede justo lacinia eget tincidunt eget tempus vel pede morbi porttitor lorem id ligula suspendisse ornare consequat lectus in est risus auctor sed tristique in,http://dummyimage.com/114x100.png/dddddd/000000,$40.81,music,Stamps
Nintendo Switch,viverra pede ac diam cras pellentesque volutpat dui maecenas tristique est et tempus semper est quam pharetra magna ac consequat metus sapien ut nunc vestibulum ante ipsum primis in faucibus orci luctus et ultrices,http://dummyimage.com/158x100.png/cc0000/ffffff,$74.11,travel,Paintings
Nike Air Max 90,nisi venenatis tristique fusce congue diam id ornare imperdiet sapien urna pretium nisl ut volutpat sapien arcu sed augue aliquam erat volutpat in congue etiam justo etiam pretium iaculis justo in hac habitasse platea dictumst etiam faucibus cursus urna ut tellus nulla ut erat,http://dummyimage.com/120x100.png/cc0000/ffffff,$25.24,sports,Paintings
Nike Air Max 90,sapien cursus vestibulum proin eu mi nulla ac enim in tempor turpis nec euismod scelerisque quam turpis adipiscing lorem vitae mattis nibh ligula nec sem duis aliquam convallis nunc proin at turpis a pede posuere nonummy integer non velit donec,http://dummyimage.com/200x100.png/dddddd/000000,$63.37,fashion,Stamps
