Title,Description,Media,Price,Tags,Collection
Rolex Submariner Watch,augue aliquam erat volutpat in congue etiam justo etiam pretium iaculis justo in hac habitasse platea dictumst etiam faucibus cursus urna ut tellus nulla ut erat id,http://dummyimage.com/182x100.png/dddddd/000000,$9.74,technology,Stamps
Tiffany & Co. Diamond Necklace,pretium iaculis justo in hac habitasse platea dictumst etiam faucibus cursus urna ut tellus nulla ut erat id mauris vulputate elementum nullam varius nulla facilisi cras non velit nec nisi vulputate nonummy maecenas tincidunt,http://dummyimage.com/173x100.png/ff4444/ffffff,$90.71,movies,Coins
Nintendo Switch,mi in porttitor pede justo eu massa donec dapibus duis at velit eu est congue elementum in hac habitasse platea dictumst morbi vestibulum velit,http://dummyimage.com/220x100.png/ff4444/ffffff,$5.96,travel,Books
iPhone X,mauris ullamcorper purus sit amet nulla quisque arcu libero rutrum ac lobortis vel,http://dummyimage.com/114x100.png/5fa2dd/ffffff,$71.06,food,Books
Amazon Echo Dot,sapien cum sociis natoque penatibus et magnis dis parturient montes nascetur ridiculus mus etiam vel augue vestibulum rutrum rutrum neque aenean auctor gravida sem praesent id massa id nisl venenatis lacinia aenean sit amet justo morbi ut,http://dummyimage.com/112x100.png/5fa2dd/ffffff,$96.33,fashion,Coins
Rolex Submariner Watch,ut rhoncus aliquet pulvinar sed nisl nunc rhoncus dui vel sem sed sagittis nam congue risus semper porta volutpat quam pede lobortis ligula sit amet eleifend pede libero quis orci nullam molestie nibh in lectus pellentesque at nulla suspendisse potenti cras,http://dummyimage.com/228x100.png/cc0000/ffffff,$90.04,books,Coins
Fitbit Charge 3,velit eu est congue elementum in hac habitasse platea dictumst morbi vestibulum velit id pretium,http://dummyimage.com/133x100.png/cc0000/ffffff,$64.16,technology,Paintings
Bose QuietComfort 35 II,suspendisse ornare consequat lectus in est risus auctor sed tristique in tempus sit amet sem fusce consequat nulla nisl nunc nisl duis bibendum felis sed interdum,http://dummyimage.com/125x100.png/ff4444/ffffff,$29.79,movies,Antiques
Dyson V11 Vacuum,luctus et ultrices posuere cubilia curae donec pharetra magna vestibulum aliquet ultrices erat tortor sollicitudin mi sit amet lobortis sapien sapien non mi integer ac neque duis bibendum morbi non quam nec dui luctus rutrum nulla tellus in,http://dummyimage.com/123x100.png/cc0000/ffffff,$87.07,fashion,Stamps
Samsung Galaxy S10,massa volutpat convallis morbi odio odio elementum eu interdum eu tincidunt in leo maecenas pulvinar lobortis est phasellus sit amet erat nulla tempus vivamus in felis eu sapien cursus vestibulum,http://dummyimage.com/140x100.png/ff4444/ffffff,$73.66,food,Stamps
Canon EOS Rebel T6,eget semper rutrum nulla nunc purus phasellus in felis donec semper sapien a libero nam dui proin leo odio porttitor id consequat in consequat ut nulla,http://dummyimage.com/187x100.png/5fa2dd/ffffff,$82.04,movies,Paintings
Adidas Ultraboost,nulla facilisi cras non velit nec nisi vulputate nonummy maecenas tincidunt lacus at velit vivamus vel nulla eget eros elementum pellentesque quisque porta volutpat erat quisque erat eros viverra eget congue eget semper rutrum nulla nunc purus phasellus in felis donec semper sapien a libero,http://dummyimage.com/199x100.png/dddddd/000000,$50.55,sports,Paintings
Samsung Galaxy S10,consequat varius integer ac leo pellentesque ultrices mattis odio donec vitae nisi nam ultrices libero non mattis pulvinar nulla pede ullamcorper augue a suscipit nulla elit ac nulla sed vel enim sit amet nunc viverra dapibus nulla suscipit ligula,http://dummyimage.com/223x100.png/cc0000/ffffff,$21.92,fitness,Paintings
Fitbit Charge 3,sed magna at nunc commodo placerat praesent blandit nam nulla integer pede,http://dummyimage.com/247x100.png/ff4444/ffffff,$23.51,fitness,Paintings
Canon EOS Rebel T6,amet cursus id turpis integer aliquet massa id lobortis convallis tortor risus dapibus augue vel accumsan tellus nisi eu orci mauris lacinia sapien quis libero nullam sit amet turpis elementum ligula vehicula consequat morbi a ipsum integer a nibh in quis justo,http://dummyimage.com/235x100.png/ff4444/ffffff,$34.18,books,Coins
Sony PlayStation 4,arcu sed augue aliquam erat volutpat in congue etiam justo etiam pretium iaculis justo in hac habitasse platea dictumst etiam faucibus cursus urna ut tellus nulla ut erat id mauris,http://dummyimage.com/179x100.png/5fa2dd/ffffff,$98.77,fitness,Paintings
iPhone X,a pede posuere nonummy integer non velit donec diam neque vestibulum eget vulputate ut ultrices vel augue vestibulum ante ipsum primis in faucibus orci luctus et ultrices posuere cubilia curae donec pharetra magna vestibulum aliquet ultrices erat tortor sollicitudin mi sit amet lobortis sapien sapien,http://dummyimage.com/196x100.png/ff4444/ffffff,$7.48,art,Antiques
Nike Air Max 90,morbi vel lectus in quam fringilla rhoncus mauris enim leo rhoncus sed vestibulum sit amet cursus id turpis integer aliquet massa id,http://dummyimage.com/115x100.png/dddddd/000000,$69.62,music,Books
iPhone X,in faucibus orci luctus et ultrices posuere cubilia curae donec pharetra magna vestibulum aliquet ultrices erat tortor sollicitudin mi sit amet,http://dummyimage.com/135x100.png/ff4444/ffffff,$11.32,food,Paintings
Chanel Coco Mademoiselle Perfume,tincidunt in leo maecenas pulvinar lobortis est phasellus sit amet erat nulla tempus vivamus in felis eu,http://dummyimage.com/240x100.png/dddddd/000000,$5.74,travel,Stamps
Bose QuietComfort 35 II,duis mattis egestas metus aenean fermentum donec ut mauris eget massa tempor convallis nulla neque libero convallis eget eleifend luctus ultricies eu nibh quisque id justo sit amet sapien dignissim vestibulum vestibulum ante ipsum primis in faucibus,http://dummyimage.com/149x100.png/dddddd/000000,$46.14,fitness,Stamps
Nike Air Max 90,porttitor lacus at turpis donec posuere metus vitae ipsum aliquam non mauris morbi non lectus aliquam sit amet diam in magna bibendum imperdiet nullam orci pede venenatis non sodales sed tincidunt eu felis fusce posuere,http://dummyimage.com/115x100.png/ff4444/ffffff,$61.06,movies,Coins
Rolex Submariner Watch,quis orci eget orci vehicula condimentum curabitur in libero ut massa volutpat convallis morbi odio odio elementum eu interdum,http://dummyimage.com/182x100.png/dddddd/000000,$45.50,sports,Antiques
Gucci GG Marmont Bag,nam nulla integer pede justo lacinia eget tincidunt eget tempus vel pede morbi porttitor lorem id ligula suspendisse ornare consequat lectus in est risus auctor sed tristique in tempus sit amet sem fusce consequat nulla nisl nunc nisl,http://dummyimage.com/243x100.png/5fa2dd/ffffff,$63.09,movies,Paintings
Gucci GG Marmont Bag,augue luctus tincidunt nulla mollis molestie lorem quisque ut erat curabitur gravida nisi at nibh in hac habitasse platea dictumst aliquam augue quam sollicitudin vitae consectetuer eget rutrum at lorem integer tincidunt ante vel ipsum praesent blandit lacinia erat vestibulum sed magna at nunc,http://dummyimage.com/100x100.png/5fa2dd/ffffff,$59.12,sports,Books
Amazon Echo Dot,elit proin interdum mauris non ligula pellentesque ultrices phasellus id sapien in sapien iaculis congue vivamus metus arcu adipiscing molestie hendrerit at vulputate vitae nisl aenean lectus pellentesque eget nunc donec quis orci eget orci vehicula condimentum curabitur in libero ut massa volutpat convallis,http://dummyimage.com/133x100.png/5fa2dd/ffffff,$98.79,books,Stamps
Dyson V11 Vacuum,sollicitudin vitae consectetuer eget rutrum at lorem integer tincidunt ante vel ipsum praesent blandit lacinia erat vestibulum sed magna at nunc commodo placerat praesent blandit nam nulla integer pede justo lacinia eget tincidunt eget tempus vel pede morbi porttitor lorem id ligula suspendisse ornare,http://dummyimage.com/127x100.png/ff4444/ffffff,$39.07,books,Paintings
Rolex Submariner Watch,duis faucibus accumsan odio curabitur convallis duis consequat dui nec nisi volutpat eleifend donec ut dolor morbi,http://dummyimage.com/202x100.png/cc0000/ffffff,$30.58,technology,Coins
Amazon Echo Dot,adipiscing elit proin interdum mauris non ligula pellentesque ultrices phasellus id sapien in sapien iaculis congue vivamus metus arcu adipiscing molestie hendrerit at vulputate vitae nisl aenean lectus pellentesque eget nunc donec quis orci eget orci vehicula condimentum curabitur in libero ut massa volutpat convallis,http://dummyimage.com/159x100.png/dddddd/000000,$95.31,fitness,Antiques
MacBook Pro,vestibulum ante ipsum primis in faucibus orci luctus et ultrices posuere cubilia curae donec pharetra magna vestibulum aliquet ultrices erat tortor sollicitudin mi sit amet lobortis sapien sapien non mi integer ac neque duis bibendum morbi non quam nec,http://dummyimage.com/155x100.png/5fa2dd/ffffff,$49.34,books,Paintings
Rolex Submariner Watch,amet nunc viverra dapibus nulla suscipit ligula in lacus curabitur at ipsum ac tellus semper interdum mauris ullamcorper purus sit amet nulla quisque arcu libero rutrum ac lobortis vel,http://dummyimage.com/199x100.png/cc0000/ffffff,$36.72,fitness,Coins
Nintendo Switch,ligula pellentesque ultrices phasellus id sapien in sapien iaculis congue vivamus metus arcu adipiscing molestie hendrerit at vulputate,http://dummyimage.com/181x100.png/cc0000/ffffff,$37.36,fashion,Stamps
Lego Star Wars Millennium Falcon,mauris viverra diam vitae quam suspendisse potenti nullam porttitor lacus at turpis donec posuere metus vitae ipsum aliquam non mauris morbi non lectus aliquam sit amet diam in magna bibendum imperdiet nullam orci pede venenatis non sodales,http://dummyimage.com/219x100.png/dddddd/000000,$22.82,travel,Stamps
Canon EOS Rebel T6,congue vivamus metus arcu adipiscing molestie hendrerit at vulputate vitae nisl aenean lectus pellentesque eget nunc donec quis orci eget,http://dummyimage.com/192x100.png/dddddd/000000,$47.03,fashion,Coins
MacBook Pro,lacinia erat vestibulum sed magna at nunc commodo placerat praesent blandit nam nulla integer pede justo lacinia eget tincidunt eget tempus vel pede morbi porttitor lorem id ligula,http://dummyimage.com/148x100.png/5fa2dd/ffffff,$45.37,books,Coins
Louis Vuitton Neverfull Tote,pellentesque quisque porta volutpat erat quisque erat eros viverra eget congue eget semper rutrum nulla nunc purus phasellus in felis donec semper sapien,http://dummyimage.com/219x100.png/cc0000/ffffff,$37.98,movies,Paintings
Rolex Submariner Watch,dolor sit amet consectetuer adipiscing elit proin risus praesent lectus vestibulum,http://dummyimage.com/113x100.png/dddddd/000000,$44.16,sports,Stamps
Tiffany & Co. Diamond Necklace,nonummy integer non velit donec diam neque vestibulum eget vulputate ut ultrices vel augue vestibulum ante ipsum primis in faucibus orci luctus et,http://dummyimage.com/114x100.png/cc0000/ffffff,$26.01,art,Paintings
Chanel Coco Mademoiselle Perfume,commodo placerat praesent blandit nam nulla integer pede justo lacinia eget tincidunt eget tempus vel pede morbi porttitor lorem id ligula suspendisse ornare consequat lectus in est risus auctor sed tristique in tempus sit amet sem fusce,http://dummyimage.com/162x100.png/ff4444/ffffff,$49.48,travel,Antiques
Rolex Submariner Watch,non ligula pellentesque ultrices phasellus id sapien in sapien iaculis congue vivamus metus arcu adipiscing molestie hendrerit at vulputate vitae nisl aenean lectus pellentesque eget nunc donec quis,http://dummyimage.com/117x100.png/dddddd/000000,$23.70,music,Paintings
Lego Star Wars Millennium Falcon,quam fringilla rhoncus mauris enim leo rhoncus sed vestibulum sit amet cursus id turpis integer aliquet massa id lobortis convallis tortor risus dapibus augue vel accumsan tellus nisi eu orci,http://dummyimage.com/247x100.png/ff4444/ffffff,$79.67,sports,Stamps
Fitbit Charge 3,ut odio cras mi pede malesuada in imperdiet et commodo vulputate justo in blandit ultrices enim lorem ipsum dolor sit amet consectetuer adipiscing elit proin interdum mauris non ligula,http://dummyimage.com/150x100.png/5fa2dd/ffffff,$29.57,food,Antiques
Chanel Coco Mademoiselle Perfume,et magnis dis parturient montes nascetur ridiculus mus vivamus vestibulum sagittis sapien cum sociis natoque penatibus et magnis dis parturient montes nascetur ridiculus mus etiam vel augue vestibulum rutrum rutrum neque aenean auctor,http://dummyimage.com/150x100.png/5fa2dd/ffffff,$32.57,fashion,Stamps
MacBook Pro,sociis natoque penatibus et magnis dis parturient montes nascetur ridiculus mus vivamus vestibulum sagittis sapien cum sociis natoque,http://dummyimage.com/134x100.png/cc0000/ffffff,$50.83,fitness,Books
Tiffany & Co. Diamond Necklace,vestibulum vestibulum ante ipsum primis in faucibus orci luctus et ultrices posuere cubilia curae nulla dapibus dolor vel est donec odio justo sollicitudin ut suscipit a feugiat et eros vestibulum ac est lacinia nisi venenatis tristique fusce congue diam,http://dummyimage.com/199x100.png/dddddd/000000,$40.82,travel,Paintings
Chanel Coco Mademoiselle Perfume,eget rutrum at lorem integer tincidunt ante vel ipsum praesent blandit lacinia erat vestibulum sed magna at nunc commodo placerat praesent blandit nam nulla integer pede justo lacinia eget tincidunt eget tempus,http://dummyimage.com/131x100.png/dddddd/000000,$81.09,books,Antiques
Amazon Echo Dot,lorem vitae mattis nibh ligula nec sem duis aliquam convallis nunc proin at turpis a pede posuere nonummy integer non velit donec diam neque vestibulum eget vulputate ut ultrices vel augue vestibulum ante ipsum primis in faucibus orci luctus et ultrices posuere cubilia curae donec pharetra,http://dummyimage.com/225x100.png/ff4444/ffffff,$24.97,art,Coins
Microsoft Surface Pro,non quam nec dui luctus rutrum nulla tellus in sagittis dui vel nisl duis,http://dummyimage.com/135x100.png/cc0000/ffffff,$6.76,books,Coins
Nintendo Switch,in sagittis dui vel nisl duis ac nibh fusce lacus purus aliquet at feugiat non pretium quis lectus suspendisse potenti in eleifend quam a odio in hac habitasse,http://dummyimage.com/156x100.png/cc0000/ffffff,$72.38,books,Coins
Canon EOS Rebel T6,odio odio elementum eu interdum eu tincidunt in leo maecenas pulvinar lobortis est phasellus sit amet erat nulla tempus vivamus in felis eu sapien cursus vestibulum proin eu mi nulla,http://dummyimage.com/188x100.png/ff4444/ffffff,$55.63,technology,Books
Sony PlayStation 4,pellentesque quisque porta volutpat erat quisque erat eros viverra eget congue eget semper rutrum nulla nunc purus phasellus in felis donec semper sapien a libero nam dui proin leo odio porttitor id consequat in consequat ut nulla sed accumsan felis ut,http://dummyimage.com/101x100.png/cc0000/ffffff,$93.89,food,Coins
Nintendo Switch,purus aliquet at feugiat non pretium quis lectus suspendisse potenti in eleifend quam a odio in hac habitasse platea dictumst maecenas ut massa,http://dummyimage.com/134x100.png/cc0000/ffffff,$30.83,technology,Stamps
Adidas Ultraboost,lacus purus aliquet at feugiat non pretium quis lectus suspendisse potenti in eleifend quam a odio in hac habitasse platea dictumst maecenas ut massa quis,http://dummyimage.com/229x100.png/cc0000/ffffff,$64.12,fashion,Stamps
Fitbit Charge 3,sit amet erat nulla tempus vivamus in felis eu sapien cursus vestibulum proin eu mi,http://dummyimage.com/126x100.png/cc0000/ffffff,$83.26,travel,Antiques
Tiffany & Co. Diamond Necklace,fusce congue diam id ornare imperdiet sapien urna pretium nisl ut volutpat sapien arcu sed augue aliquam erat volutpat in congue etiam justo etiam pretium iaculis justo in hac habitasse platea dictumst etiam faucibus cursus urna ut tellus nulla ut erat id mauris vulputate elementum nullam,http://dummyimage.com/138x100.png/dddddd/000000,$34.97,fashion,Coins
Sony PlayStation 4,augue aliquam erat volutpat in congue etiam justo etiam pretium iaculis justo in hac habitasse platea dictumst etiam faucibus cursus urna ut tellus nulla ut erat id mauris vulputate elementum nullam varius nulla,http://dummyimage.com/145x100.png/cc0000/ffffff,$2.46,technology,Coins
Nike Air Max 90,dignissim vestibulum vestibulum ante ipsum primis in faucibus orci luctus et,http://dummyimage.com/165x100.png/5fa2dd/ffffff,$32.38,travel,Coins
Fitbit Charge 3,condimentum curabitur in libero ut massa volutpat convallis morbi odio odio elementum eu interdum eu tincidunt in leo maecenas pulvinar lobortis est phasellus sit amet erat nulla tempus vivamus in felis eu sapien cursus vestibulum proin eu mi nulla ac enim in tempor turpis nec euismod scelerisque,http://dummyimage.com/193x100.png/5fa2dd/ffffff,$70.14,books,Books
Dyson V11 Vacuum,amet erat nulla tempus vivamus in felis eu sapien cursus vestibulum proin eu mi,http://dummyimage.com/225x100.png/ff4444/ffffff,$26.73,books,Stamps
Gucci GG Marmont Bag,pretium nisl ut volutpat sapien arcu sed augue aliquam erat volutpat in congue etiam justo etiam pretium iaculis,http://dummyimage.com/166x100.png/dddddd/000000,$86.75,art,Antiques
Nike Air Max 90,ac neque duis bibendum morbi non quam nec dui luctus rutrum nulla tellus in sagittis dui vel nisl duis ac nibh fusce lacus purus aliquet at feugiat non pretium quis lectus suspendisse,http://dummyimage.com/248x100.png/dddddd/000000,$1.27,travel,Stamps
Gucci GG Marmont Bag,sit amet turpis elementum ligula vehicula consequat morbi a ipsum integer,http://dummyimage.com/169x100.png/5fa2dd/ffffff,$95.11,travel,Coins
Rolex Submariner Watch,quam sapien varius ut blandit non interdum in ante vestibulum ante ipsum primis in faucibus orci luctus et ultrices posuere cubilia curae duis faucibus accumsan odio curabitur convallis duis consequat dui nec nisi volutpat eleifend donec ut dolor morbi vel lectus in quam fringilla rhoncus,http://dummyimage.com/179x100.png/5fa2dd/ffffff,$39.14,music,Stamps
Chanel Coco Mademoiselle Perfume,odio consequat varius integer ac leo pellentesque ultrices mattis odio donec vitae,http://dummyimage.com/212x100.png/dddddd/000000,$61.81,books,Paintings
Dyson V11 Vacuum,lobortis ligula sit amet eleifend pede libero quis orci nullam molestie nibh in lectus pellentesque at nulla suspendisse potenti cras in purus eu,http://dummyimage.com/210x100.png/cc0000/ffffff,$3.66,fashion,Stamps
Fitbit Charge 3,amet cursus id turpis integer aliquet massa id lobortis convallis tortor risus dapibus augue vel accumsan tellus nisi eu orci mauris lacinia sapien quis libero nullam sit amet turpis elementum ligula,http://dummyimage.com/167x100.png/dddddd/000000,$33.22,food,Paintings
MacBook Pro,nunc proin at turpis a pede posuere nonummy integer non velit donec diam neque vestibulum eget vulputate ut ultrices vel augue vestibulum ante ipsum primis in faucibus orci luctus et ultrices posuere cubilia curae donec pharetra magna vestibulum aliquet ultrices erat tortor sollicitudin mi sit amet,http://dummyimage.com/167x100.png/dddddd/000000,$5.42,fashion,Books
Nintendo Switch,nunc vestibulum ante ipsum primis in faucibus orci luctus et ultrices posuere cubilia curae mauris viverra diam vitae quam suspendisse potenti nullam porttitor lacus at,http://dummyimage.com/166x100.png/ff4444/ffffff,$64.57,movies,Books
Lego Star Wars Millennium Falcon,lacus at velit vivamus vel nulla eget eros elementum pellentesque quisque porta volutpat erat quisque erat eros viverra eget congue eget semper rutrum nulla nunc purus phasellus in felis donec semper sapien a libero nam dui proin,http://dummyimage.com/105x100.png/dddddd/000000,$32.34,music,Stamps
Adidas Ultraboost,dolor vel est donec odio justo sollicitudin ut suscipit a feugiat et eros,http://dummyimage.com/241x100.png/5fa2dd/ffffff,$70.44,movies,Antiques
Lego Star Wars Millennium Falcon,sapien dignissim vestibulum vestibulum ante ipsum primis in faucibus orci luctus et ultrices posuere cubilia curae nulla dapibus dolor vel est,http://dummyimage.com/235x100.png/ff4444/ffffff,$30.80,technology,Antiques
Adidas Ultraboost,tempus vivamus in felis eu sapien cursus vestibulum proin eu mi nulla ac enim in tempor turpis nec euismod scelerisque quam turpis adipiscing lorem vitae mattis nibh ligula nec sem duis aliquam convallis nunc proin at turpis a pede posuere nonummy integer non velit donec,http://dummyimage.com/157x100.png/dddddd/000000,$43.99,music,Antiques
Dyson V11 Vacuum,donec diam neque vestibulum eget vulputate ut ultrices vel augue vestibulum ante ipsum primis in faucibus orci luctus et ultrices posuere cubilia curae donec pharetra magna vestibulum aliquet ultrices erat tortor sollicitudin mi sit amet lobortis sapien sapien non mi integer ac neque duis bibendum morbi non quam nec,http://dummyimage.com/160x100.png/ff4444/ffffff,$17.06,travel,Books
Amazon Echo Dot,quis turpis eget elit sodales scelerisque mauris sit amet eros suspendisse accumsan tortor quis turpis sed ante vivamus tortor,http://dummyimage.com/227x100.png/5fa2dd/ffffff,$91.16,food,Antiques
Nintendo Switch,amet turpis elementum ligula vehicula consequat morbi a ipsum integer a nibh in quis justo maecenas rhoncus aliquam lacus morbi quis tortor,http://dummyimage.com/192x100.png/dddddd/000000,$21.26,art,Stamps
Bose QuietComfort 35 II,nisl duis ac nibh fusce lacus purus aliquet at feugiat non,http://dummyimage.com/148x100.png/dddddd/000000,$23.14,books,Books
iPhone X,in felis eu sapien cursus vestibulum proin eu mi nulla ac enim in tempor turpis nec euismod scelerisque quam turpis adipiscing lorem vitae,http://dummyimage.com/155x100.png/cc0000/ffffff,$25.63,music,Antiques
Lego Star Wars Millennium Falcon,duis faucibus accumsan odio curabitur convallis duis consequat dui nec nisi volutpat eleifend donec ut dolor morbi vel lectus in quam fringilla rhoncus mauris enim leo rhoncus sed vestibulum sit amet cursus id turpis integer aliquet massa id lobortis convallis tortor risus,http://dummyimage.com/126x100.png/5fa2dd/ffffff,$51.24,sports,Stamps
Fitbit Charge 3,velit id pretium iaculis diam erat fermentum justo nec condimentum neque sapien placerat ante nulla justo aliquam quis turpis eget elit sodales scelerisque mauris sit amet eros suspendisse accumsan tortor quis turpis sed ante vivamus tortor duis mattis egestas metus aenean fermentum donec ut mauris eget massa tempor convallis nulla,http://dummyimage.com/142x100.png/5fa2dd/ffffff,$62.76,travel,Books
Nintendo Switch,ante vel ipsum praesent blandit lacinia erat vestibulum sed magna at nunc commodo placerat praesent blandit nam nulla integer pede justo lacinia eget tincidunt eget tempus vel pede morbi porttitor lorem id ligula suspendisse ornare consequat lectus in est risus auctor sed tristique in tempus sit amet sem fusce,http://dummyimage.com/117x100.png/dddddd/000000,$13.60,movies,Antiques
Chanel Coco Mademoiselle Perfume,nam nulla integer pede justo lacinia eget tincidunt eget tempus vel pede morbi porttitor lorem id,http://dummyimage.com/175x100.png/dddddd/000000,$30.89,food,Stamps
iPhone X,auctor sed tristique in tempus sit amet sem fusce consequat nulla nisl nunc nisl duis bibendum felis sed interdum venenatis turpis enim blandit,http://dummyimage.com/220x100.png/cc0000/ffffff,$31.86,fitness,Coins
Dyson V11 Vacuum,eu nibh quisque id justo sit amet sapien dignissim vestibulum vestibulum ante ipsum primis in faucibus orci luctus et ultrices posuere cubilia curae nulla dapibus dolor vel est donec odio justo sollicitudin ut suscipit a feugiat et eros vestibulum ac est lacinia nisi venenatis tristique fusce congue diam id ornare,http://dummyimage.com/249x100.png/ff4444/ffffff,$73.64,food,Books
Chanel Coco Mademoiselle Perfume,ullamcorper purus sit amet nulla quisque arcu libero rutrum ac lobortis vel,http://dummyimage.com/208x100.png/cc0000/ffffff,$66.03,sports,Books
Sony PlayStation 4,risus semper porta volutpat quam pede lobortis ligula sit amet eleifend pede libero quis orci nullam molestie nibh,http://dummyimage.com/238x100.png/cc0000/ffffff,$87.26,music,Books
Lego Star Wars Millennium Falcon,rhoncus aliquam lacus morbi quis tortor id nulla ultrices aliquet maecenas leo odio condimentum id luctus nec molestie sed justo pellentesque viverra pede ac diam cras pellentesque volutpat dui maecenas tristique est et tempus semper est quam pharetra magna ac consequat metus sapien ut nunc vestibulum ante ipsum primis in,http://dummyimage.com/200x100.png/ff4444/ffffff,$94.08,technology,Books
Rolex Submariner Watch,phasellus sit amet erat nulla tempus vivamus in felis eu sapien cursus vestibulum proin eu mi nulla ac enim in tempor turpis nec euismod scelerisque quam turpis adipiscing lorem vitae,http://dummyimage.com/185x100.png/5fa2dd/ffffff,$28.47,travel,Paintings
Adidas Ultraboost,luctus et ultrices posuere cubilia curae donec pharetra magna vestibulum aliquet ultrices erat tortor sollicitudin mi sit amet lobortis sapien sapien non mi integer ac,http://dummyimage.com/116x100.png/dddddd/000000,$85.30,fitness,Books
Tiffany & Co. Diamond Necklace,enim blandit mi in porttitor pede justo eu massa donec dapibus duis at velit eu est congue elementum in hac habitasse platea dictumst morbi vestibulum velit id pretium iaculis diam erat fermentum justo nec condimentum neque sapien placerat ante nulla justo aliquam quis turpis eget elit sodales,http://dummyimage.com/230x100.png/cc0000/ffffff,$74.07,travel,Coins
Amazon Echo Dot,posuere cubilia curae nulla dapibus dolor vel est donec odio justo sollicitudin ut suscipit a feugiat et eros vestibulum ac est lacinia nisi venenatis tristique fusce congue diam id ornare imperdiet sapien urna pretium nisl ut volutpat sapien arcu sed,http://dummyimage.com/179x100.png/dddddd/000000,$92.39,movies,Antiques
Nintendo Switch,et ultrices posuere cubilia curae duis faucibus accumsan odio curabitur convallis duis consequat,http://dummyimage.com/250x100.png/5fa2dd/ffffff,$49.54,books,Paintings
Samsung Galaxy S10,primis in faucibus orci luctus et ultrices posuere cubilia curae nulla dapibus dolor vel est donec odio justo,http://dummyimage.com/176x100.png/cc0000/ffffff,$37.67,sports,Books
