Title,Description,Media,Price,Tags,Collection
Rolex Submariner Watch,ligula sit amet eleifend pede libero quis orci nullam molestie nibh in lectus pellentesque at nulla suspendisse potenti cras in purus eu magna vulputate luctus cum sociis natoque penatibus et magnis dis parturient montes nascetur ridiculus mus vivamus vestibulum sagittis sapien cum sociis natoque penatibus et magnis dis,http://dummyimage.com/153x100.png/ff4444/ffffff,$32.66,fitness,Stamps
GoPro Hero 7,leo odio condimentum id luctus nec molestie sed justo pellentesque viverra pede ac diam cras pellentesque volutpat dui maecenas tristique est,http://dummyimage.com/101x100.png/cc0000/ffffff,$11.04,movies,Antiques
Louis Vuitton Neverfull Tote,phasellus id sapien in sapien iaculis congue vivamus metus arcu adipiscing molestie hendrerit at vulputate vitae nisl aenean lectus pellentesque eget nunc donec quis,http://dummyimage.com/156x100.png/cc0000/ffffff,$98.87,technology,Antiques
Bose QuietComfort 35 II,nisi eu orci mauris lacinia sapien quis libero nullam sit amet turpis elementum ligula vehicula consequat morbi a ipsum integer a nibh in quis justo maecenas rhoncus aliquam lacus morbi quis tortor id nulla ultrices aliquet maecenas leo odio,http://dummyimage.com/133x100.png/ff4444/ffffff,$17.71,sports,Paintings
Nike Air Max 90,aliquet pulvinar sed nisl nunc rhoncus dui vel sem sed sagittis nam congue risus semper porta volutpat quam pede lobortis ligula sit amet eleifend pede libero quis orci nullam,http://dummyimage.com/110x100.png/ff4444/ffffff,$27.97,fashion,Paintings
Gucci GG Marmont Bag,hac habitasse platea dictumst etiam faucibus cursus urna ut tellus nulla ut erat id mauris,http://dummyimage.com/148x100.png/ff4444/ffffff,$94.07,movies,Antiques
Canon EOS Rebel T6,lobortis convallis tortor risus dapibus augue vel accumsan tellus nisi eu orci mauris lacinia sapien quis libero nullam sit amet turpis elementum ligula vehicula,http://dummyimage.com/207x100.png/cc0000/ffffff,$69.55,travel,Coins
iPhone X,hac habitasse platea dictumst etiam faucibus cursus urna ut tellus nulla ut erat id mauris vulputate elementum nullam varius nulla facilisi cras non velit nec nisi vulputate nonummy maecenas tincidunt lacus at,http://dummyimage.com/188x100.png/cc0000/ffffff,$55.09,movies,Coins
Samsung Galaxy S10,sapien varius ut blandit non interdum in ante vestibulum ante ipsum primis in faucibus orci luctus et ultrices posuere cubilia curae duis faucibus accumsan odio curabitur convallis duis consequat dui nec nisi volutpat eleifend donec ut dolor morbi,http://dummyimage.com/112x100.png/cc0000/ffffff,$71.67,art,Antiques
Louis Vuitton Neverfull Tote,pretium iaculis justo in hac habitasse platea dictumst etiam faucibus cursus urna ut tellus nulla ut erat id mauris vulputate elementum nullam varius,http://dummyimage.com/164x100.png/dddddd/000000,$66.10,fitness,Coins
Sony PlayStation 4,nibh in hac habitasse platea dictumst aliquam augue quam sollicitudin vitae consectetuer eget rutrum at lorem integer tincidunt ante vel ipsum praesent blandit lacinia erat vestibulum sed magna at nunc commodo placerat praesent blandit nam nulla integer pede justo lacinia eget tincidunt eget tempus vel pede,http://dummyimage.com/167x100.png/cc0000/ffffff,$77.16,movies,Antiques
Gucci GG Marmont Bag,volutpat quam pede lobortis ligula sit amet eleifend pede libero quis orci nullam molestie nibh in lectus pellentesque,http://dummyimage.com/204x100.png/cc0000/ffffff,$16.43,music,Antiques
Fitbit Charge 3,orci luctus et ultrices posuere cubilia curae donec pharetra magna vestibulum aliquet ultrices erat tortor sollicitudin mi,http://dummyimage.com/113x100.png/ff4444/ffffff,$94.92,sports,Books
Canon EOS Rebel T6,faucibus orci luctus et ultrices posuere cubilia curae duis faucibus accumsan odio curabitur convallis duis consequat dui nec nisi,http://dummyimage.com/145x100.png/5fa2dd/ffffff,$22.50,music,Books
Sony PlayStation 4,orci pede venenatis non sodales sed tincidunt eu felis fusce posuere felis sed lacus morbi sem mauris laoreet ut rhoncus aliquet pulvinar sed nisl nunc rhoncus dui vel sem sed sagittis nam congue risus semper porta volutpat,http://dummyimage.com/108x100.png/5fa2dd/ffffff,$69.43,sports,Coins
Louis Vuitton Neverfull Tote,eu magna vulputate luctus cum sociis natoque penatibus et magnis dis parturient montes nascetur ridiculus mus vivamus vestibulum sagittis sapien cum sociis natoque penatibus et magnis dis parturient montes nascetur ridiculus mus etiam vel augue vestibulum rutrum rutrum neque aenean auctor gravida,http://dummyimage.com/239x100.png/5fa2dd/ffffff,$45.15,food,Books
Rolex Submariner Watch,sapien cum sociis natoque penatibus et magnis dis parturient montes nascetur ridiculus mus etiam vel augue vestibulum rutrum rutrum neque aenean auctor gravida sem praesent,http://dummyimage.com/188x100.png/ff4444/ffffff,$83.36,travel,Stamps
GoPro Hero 7,sit amet eleifend pede libero quis orci nullam molestie nibh in lectus pellentesque at,http://dummyimage.com/186x100.png/5fa2dd/ffffff,$11.05,books,Antiques
Amazon Echo Dot,neque sapien placerat ante nulla justo aliquam quis turpis eget elit sodales,http://dummyimage.com/217x100.png/dddddd/000000,$54.41,travel,Paintings
GoPro Hero 7,morbi vestibulum velit id pretium iaculis diam erat fermentum justo nec condimentum neque sapien placerat ante nulla justo aliquam quis turpis eget elit sodales scelerisque mauris sit amet eros suspendisse accumsan tortor quis turpis sed ante vivamus tortor duis mattis egestas,http://dummyimage.com/137x100.png/cc0000/ffffff,$96.44,art,Antiques
Bose QuietComfort 35 II,quis turpis sed ante vivamus tortor duis mattis egestas metus aenean fermentum donec ut mauris eget massa tempor convallis nulla neque libero convallis eget eleifend luctus ultricies eu nibh quisque id justo sit amet sapien dignissim vestibulum vestibulum ante ipsum primis in faucibus orci luctus et ultrices,http://dummyimage.com/171x100.png/cc0000/ffffff,$92.15,art,Coins
Fitbit Charge 3,platea dictumst morbi vestibulum velit id pretium iaculis diam erat fermentum justo nec condimentum neque sapien placerat ante nulla justo aliquam quis turpis eget elit sodales scelerisque mauris sit amet eros suspendisse accumsan tortor quis turpis sed ante vivamus tortor duis mattis egestas metus aenean fermentum donec ut mauris eget,http://dummyimage.com/149x100.png/cc0000/ffffff,$59.57,fitness,Paintings
Samsung Galaxy S10,quam turpis adipiscing lorem vitae mattis nibh ligula nec sem duis aliquam convallis nunc proin at turpis a pede posuere nonummy integer non velit donec diam neque vestibulum eget vulputate ut ultrices vel augue,http://dummyimage.com/239x100.png/ff4444/ffffff,$72.31,art,Coins
Adidas Ultraboost,lacus purus aliquet at feugiat non pretium quis lectus suspendisse potenti in eleifend quam a odio in hac habitasse platea dictumst maecenas ut massa quis augue luctus tincidunt,http://dummyimage.com/233x100.png/ff4444/ffffff,$62.10,food,Coins
GoPro Hero 7,lorem quisque ut erat curabitur gravida nisi at nibh in hac habitasse platea dictumst aliquam augue quam sollicitudin vitae consectetuer eget rutrum at lorem integer tincidunt ante vel ipsum praesent blandit lacinia erat vestibulum sed magna at nunc commodo placerat praesent blandit nam nulla integer,http://dummyimage.com/147x100.png/5fa2dd/ffffff,$54.67,music,Stamps
Adidas Ultraboost,eget elit sodales scelerisque mauris sit amet eros suspendisse accumsan tortor quis turpis,http://dummyimage.com/190x100.png/ff4444/ffffff,$3.45,fitness,Paintings
MacBook Pro,convallis nulla neque libero convallis eget eleifend luctus ultricies eu nibh,http://dummyimage.com/129x100.png/cc0000/ffffff,$6.38,sports,Paintings
iPhone X,non lectus aliquam sit amet diam in magna bibendum imperdiet nullam orci pede venenatis non sodales sed tincidunt eu felis fusce,http://dummyimage.com/110x100.png/cc0000/ffffff,$61.10,travel,Antiques
Lego Star Wars Millennium Falcon,dolor vel est donec odio justo sollicitudin ut suscipit a feugiat et eros vestibulum ac est lacinia nisi venenatis tristique fusce congue diam id ornare imperdiet sapien urna pretium nisl ut volutpat sapien arcu sed augue aliquam erat volutpat in congue etiam justo etiam pretium iaculis,http://dummyimage.com/246x100.png/cc0000/ffffff,$27.31,travel,Paintings
Microsoft Surface Pro,convallis eget eleifend luctus ultricies eu nibh quisque id justo sit amet sapien dignissim vestibulum vestibulum ante ipsum primis in faucibus orci luctus et ultrices posuere cubilia curae nulla dapibus dolor vel est donec,http://dummyimage.com/244x100.png/dddddd/000000,$83.25,sports,Books
Lego Star Wars Millennium Falcon,in quam fringilla rhoncus mauris enim leo rhoncus sed vestibulum sit amet cursus id turpis integer aliquet massa id lobortis convallis tortor risus dapibus augue vel accumsan tellus nisi eu orci,http://dummyimage.com/108x100.png/cc0000/ffffff,$65.84,sports,Paintings
Microsoft Surface Pro,non quam nec dui luctus rutrum nulla tellus in sagittis dui vel nisl duis ac nibh fusce lacus purus aliquet at feugiat non pretium quis lectus suspendisse potenti,http://dummyimage.com/220x100.png/cc0000/ffffff,$71.61,sports,Books
Lego Star Wars Millennium Falcon,iaculis congue vivamus metus arcu adipiscing molestie hendrerit at vulputate vitae nisl aenean lectus pellentesque eget nunc donec quis orci eget orci vehicula condimentum curabitur in libero ut massa volutpat convallis morbi odio odio elementum eu interdum eu tincidunt in leo maecenas pulvinar lobortis est phasellus sit amet,http://dummyimage.com/150x100.png/ff4444/ffffff,$86.46,food,Stamps
Lego Star Wars Millennium Falcon,natoque penatibus et magnis dis parturient montes nascetur ridiculus mus etiam vel augue vestibulum rutrum rutrum neque aenean auctor gravida sem praesent id massa id nisl venenatis lacinia aenean sit amet justo morbi ut,http://dummyimage.com/188x100.png/ff4444/ffffff,$46.59,sports,Coins
Canon EOS Rebel T6,proin eu mi nulla ac enim in tempor turpis nec euismod scelerisque quam turpis adipiscing lorem vitae mattis nibh ligula nec sem duis aliquam convallis nunc proin at turpis a pede posuere nonummy integer non velit donec diam neque vestibulum eget vulputate ut ultrices,http://dummyimage.com/130x100.png/5fa2dd/ffffff,$45.41,fashion,Stamps
Samsung Galaxy S10,eget semper rutrum nulla nunc purus phasellus in felis donec,http://dummyimage.com/116x100.png/cc0000/ffffff,$55.51,fitness,Paintings
Sony PlayStation 4,habitasse platea dictumst aliquam augue quam sollicitudin vitae consectetuer eget rutrum at lorem integer tincidunt ante vel ipsum praesent blandit lacinia erat,http://dummyimage.com/195x100.png/dddddd/000000,$52.40,art,Books
Gucci GG Marmont Bag,quis lectus suspendisse potenti in eleifend quam a odio in hac habitasse platea dictumst maecenas ut massa quis augue luctus tincidunt nulla mollis molestie lorem quisque ut erat curabitur gravida nisi at nibh in hac habitasse platea,http://dummyimage.com/140x100.png/dddddd/000000,$88.80,movies,Antiques
Canon EOS Rebel T6,in lacus curabitur at ipsum ac tellus semper interdum mauris ullamcorper purus sit amet,http://dummyimage.com/191x100.png/ff4444/ffffff,$46.51,travel,Paintings
Lego Star Wars Millennium Falcon,justo sollicitudin ut suscipit a feugiat et eros vestibulum ac est lacinia nisi venenatis tristique fusce congue diam id ornare imperdiet sapien urna pretium nisl ut volutpat sapien arcu sed augue aliquam erat volutpat in congue,http://dummyimage.com/128x100.png/dddddd/000000,$55.31,fitness,Books
Microsoft Surface Pro,aenean auctor gravida sem praesent id massa id nisl venenatis lacinia aenean sit amet justo morbi ut odio cras mi pede malesuada in,http://dummyimage.com/243x100.png/dddddd/000000,$62.22,art,Stamps
Dyson V11 Vacuum,volutpat convallis morbi odio odio elementum eu interdum eu tincidunt in leo maecenas pulvinar lobortis est phasellus sit amet erat nulla tempus vivamus in felis eu sapien cursus vestibulum proin eu mi nulla ac enim in tempor turpis,http://dummyimage.com/198x100.png/dddddd/000000,$82.06,sports,Stamps
Chanel Coco Mademoiselle Perfume,semper interdum mauris ullamcorper purus sit amet nulla quisque arcu libero rutrum ac lobortis vel dapibus at diam nam,http://dummyimage.com/161x100.png/dddddd/000000,$0.94,art,Antiques
Rolex Submariner Watch,ac nulla sed vel enim sit amet nunc viverra dapibus nulla suscipit ligula in lacus curabitur at ipsum ac tellus semper interdum mauris ullamcorper purus sit amet nulla quisque arcu libero rutrum ac lobortis vel dapibus at diam nam tristique tortor,http://dummyimage.com/106x100.png/cc0000/ffffff,$90.43,travel,Books
Bose QuietComfort 35 II,felis sed lacus morbi sem mauris laoreet ut rhoncus aliquet pulvinar sed nisl nunc,http://dummyimage.com/184x100.png/5fa2dd/ffffff,$79.31,sports,Antiques
Microsoft Surface Pro,justo sollicitudin ut suscipit a feugiat et eros vestibulum ac est lacinia nisi venenatis tristique fusce congue diam id ornare imperdiet,http://dummyimage.com/250x100.png/dddddd/000000,$93.89,fashion,Books
Microsoft Surface Pro,vel nisl duis ac nibh fusce lacus purus aliquet at feugiat non pretium quis lectus suspendisse potenti in eleifend quam a odio in hac habitasse platea dictumst maecenas ut massa quis augue luctus tincidunt nulla,http://dummyimage.com/229x100.png/5fa2dd/ffffff,$15.41,technology,Coins
Bose QuietComfort 35 II,a nibh in quis justo maecenas rhoncus aliquam lacus morbi quis tortor id nulla ultrices aliquet,http://dummyimage.com/139x100.png/5fa2dd/ffffff,$95.80,art,Stamps
GoPro Hero 7,ultrices libero non mattis pulvinar nulla pede ullamcorper augue a suscipit nulla elit ac nulla sed vel enim sit amet nunc viverra dapibus nulla suscipit ligula in lacus curabitur at ipsum ac tellus semper interdum mauris ullamcorper purus,http://dummyimage.com/130x100.png/cc0000/ffffff,$60.08,fitness,Coins
Chanel Coco Mademoiselle Perfume,quam turpis adipiscing lorem vitae mattis nibh ligula nec sem duis aliquam convallis nunc proin at turpis a pede posuere nonummy integer non velit donec diam neque,http://dummyimage.com/202x100.png/dddddd/000000,$3.83,books,Stamps
Fitbit Charge 3,quis tortor id nulla ultrices aliquet maecenas leo odio condimentum id luctus nec molestie sed justo pellentesque viverra pede,http://dummyimage.com/212x100.png/cc0000/ffffff,$92.39,movies,Antiques
GoPro Hero 7,vivamus vestibulum sagittis sapien cum sociis natoque penatibus et magnis dis parturient montes nascetur,http://dummyimage.com/116x100.png/ff4444/ffffff,$53.04,music,Coins
GoPro Hero 7,ipsum dolor sit amet consectetuer adipiscing elit proin interdum mauris non ligula pellentesque ultrices phasellus id sapien in sapien iaculis congue vivamus metus arcu adipiscing molestie hendrerit at vulputate vitae nisl aenean lectus pellentesque eget nunc donec,http://dummyimage.com/175x100.png/dddddd/000000,$66.77,books,Paintings
Nintendo Switch,ipsum primis in faucibus orci luctus et ultrices posuere cubilia curae donec pharetra magna vestibulum aliquet ultrices erat tortor sollicitudin mi sit,http://dummyimage.com/122x100.png/cc0000/ffffff,$3.30,food,Stamps
Samsung Galaxy S10,ipsum primis in faucibus orci luctus et ultrices posuere cubilia curae mauris viverra diam vitae quam suspendisse potenti nullam porttitor lacus,http://dummyimage.com/103x100.png/dddddd/000000,$67.46,travel,Stamps
Tiffany & Co. Diamond Necklace,congue elementum in hac habitasse platea dictumst morbi vestibulum velit id pretium iaculis diam erat fermentum justo nec,http://dummyimage.com/235x100.png/cc0000/ffffff,$56.39,fashion,Stamps
Amazon Echo Dot,quisque id justo sit amet sapien dignissim vestibulum vestibulum ante ipsum primis in faucibus orci luctus et ultrices posuere cubilia curae nulla dapibus dolor vel est,http://dummyimage.com/250x100.png/ff4444/ffffff,$66.26,sports,Stamps
iPhone X,amet turpis elementum ligula vehicula consequat morbi a ipsum integer a nibh in quis justo maecenas rhoncus aliquam lacus morbi quis tortor id nulla ultrices aliquet maecenas leo odio condimentum id luctus nec molestie sed,http://dummyimage.com/135x100.png/cc0000/ffffff,$14.41,fashion,Paintings
Chanel Coco Mademoiselle Perfume,justo nec condimentum neque sapien placerat ante nulla justo aliquam quis turpis eget elit sodales scelerisque mauris sit amet eros suspendisse accumsan tortor quis turpis sed ante vivamus tortor duis mattis egestas metus aenean fermentum donec ut mauris eget massa tempor convallis nulla neque libero convallis eget eleifend luctus ultricies,http://dummyimage.com/243x100.png/ff4444/ffffff,$60.85,sports,Stamps
Fitbit Charge 3,egestas metus aenean fermentum donec ut mauris eget massa tempor convallis nulla neque libero convallis eget eleifend luctus ultricies eu nibh quisque id,http://dummyimage.com/205x100.png/ff4444/ffffff,$51.41,fitness,Stamps
Canon EOS Rebel T6,eu orci mauris lacinia sapien quis libero nullam sit amet turpis elementum ligula vehicula consequat morbi a ipsum integer a nibh in quis,http://dummyimage.com/185x100.png/dddddd/000000,$28.35,fitness,Coins
Bose QuietComfort 35 II,lacinia eget tincidunt eget tempus vel pede morbi porttitor lorem id ligula suspendisse ornare consequat lectus in est risus auctor sed tristique in tempus sit amet sem fusce consequat nulla nisl nunc nisl duis bibendum felis sed,http://dummyimage.com/205x100.png/cc0000/ffffff,$28.87,technology,Antiques
Adidas Ultraboost,congue elementum in hac habitasse platea dictumst morbi vestibulum velit id pretium iaculis diam erat fermentum justo nec condimentum neque sapien placerat,http://dummyimage.com/231x100.png/dddddd/000000,$4.98,fitness,Stamps
Fitbit Charge 3,vestibulum sed magna at nunc commodo placerat praesent blandit nam nulla integer pede justo lacinia eget,http://dummyimage.com/171x100.png/5fa2dd/ffffff,$15.22,art,Paintings
Microsoft Surface Pro,integer a nibh in quis justo maecenas rhoncus aliquam lacus morbi,http://dummyimage.com/139x100.png/ff4444/ffffff,$43.73,art,Antiques
Louis Vuitton Neverfull Tote,faucibus cursus urna ut tellus nulla ut erat id mauris vulputate elementum nullam varius nulla facilisi,http://dummyimage.com/149x100.png/cc0000/ffffff,$64.64,fitness,Books
Amazon Echo Dot,vestibulum proin eu mi nulla ac enim in tempor turpis nec euismod scelerisque quam turpis adipiscing lorem vitae mattis nibh ligula,http://dummyimage.com/199x100.png/dddddd/000000,$76.88,food,Coins
Nike Air Max 90,sed magna at nunc commodo placerat praesent blandit nam nulla integer pede justo lacinia eget tincidunt eget tempus vel pede morbi porttitor lorem id ligula suspendisse ornare,http://dummyimage.com/133x100.png/5fa2dd/ffffff,$46.01,travel,Paintings
Lego Star Wars Millennium Falcon,aliquet ultrices erat tortor sollicitudin mi sit amet lobortis sapien sapien non mi integer ac neque duis bibendum morbi non quam nec dui luctus rutrum nulla tellus in sagittis dui vel nisl duis ac nibh,http://dummyimage.com/101x100.png/cc0000/ffffff,$42.72,music,Books
Sony PlayStation 4,id luctus nec molestie sed justo pellentesque viverra pede ac diam cras pellentesque volutpat dui maecenas tristique est et tempus semper est quam pharetra magna ac consequat metus sapien ut nunc vestibulum ante ipsum,http://dummyimage.com/206x100.png/ff4444/ffffff,$76.98,fashion,Paintings
Tiffany & Co. Diamond Necklace,sit amet erat nulla tempus vivamus in felis eu sapien cursus vestibulum proin eu mi nulla ac enim in tempor turpis nec euismod scelerisque quam turpis,http://dummyimage.com/101x100.png/dddddd/000000,$35.53,books,Stamps
Nintendo Switch,integer pede justo lacinia eget tincidunt eget tempus vel pede morbi porttitor lorem id ligula suspendisse ornare consequat lectus in est risus auctor sed tristique in tempus sit amet sem fusce consequat nulla nisl nunc,http://dummyimage.com/112x100.png/dddddd/000000,$92.32,travel,Coins
iPhone X,id nisl venenatis lacinia aenean sit amet justo morbi ut odio cras mi pede malesuada in imperdiet et commodo vulputate justo in blandit ultrices enim lorem ipsum dolor sit amet consectetuer adipiscing elit proin interdum mauris non ligula pellentesque ultrices phasellus id sapien in sapien iaculis congue,http://dummyimage.com/194x100.png/ff4444/ffffff,$63.59,movies,Books
Chanel Coco Mademoiselle Perfume,diam neque vestibulum eget vulputate ut ultrices vel augue vestibulum ante ipsum primis in faucibus orci luctus et ultrices posuere cubilia curae donec pharetra magna vestibulum aliquet ultrices erat tortor sollicitudin mi sit amet lobortis sapien sapien non mi integer ac neque duis bibendum,http://dummyimage.com/133x100.png/5fa2dd/ffffff,$91.52,fitness,Stamps
Microsoft Surface Pro,metus vitae ipsum aliquam non mauris morbi non lectus aliquam sit amet diam in magna bibendum imperdiet nullam orci pede venenatis non sodales sed tincidunt eu felis fusce posuere felis sed lacus,http://dummyimage.com/106x100.png/ff4444/ffffff,$9.93,fitness,Stamps
Sony PlayStation 4,proin at turpis a pede posuere nonummy integer non velit donec diam neque vestibulum eget vulputate ut ultrices vel augue vestibulum ante ipsum primis in faucibus orci luctus et ultrices posuere cubilia curae,http://dummyimage.com/109x100.png/ff4444/ffffff,$57.43,music,Coins
Canon EOS Rebel T6,id nisl venenatis lacinia aenean sit amet justo morbi ut odio cras mi pede malesuada in imperdiet et commodo vulputate justo in blandit ultrices enim lorem ipsum dolor sit amet consectetuer adipiscing elit proin interdum mauris non,http://dummyimage.com/110x100.png/ff4444/ffffff,$41.27,music,Paintings
Adidas Ultraboost,mauris eget massa tempor convallis nulla neque libero convallis eget eleifend luctus ultricies eu nibh quisque id justo sit amet sapien dignissim vestibulum vestibulum ante ipsum primis in faucibus,http://dummyimage.com/246x100.png/cc0000/ffffff,$95.77,technology,Paintings
Nintendo Switch,ridiculus mus vivamus vestibulum sagittis sapien cum sociis natoque penatibus et magnis dis parturient montes nascetur ridiculus mus etiam vel augue vestibulum rutrum rutrum neque aenean,http://dummyimage.com/108x100.png/ff4444/ffffff,$92.41,books,Paintings
Nike Air Max 90,ac nibh fusce lacus purus aliquet at feugiat non pretium quis lectus suspendisse potenti in eleifend quam a odio in hac habitasse platea dictumst maecenas ut massa quis augue luctus tincidunt nulla mollis molestie,http://dummyimage.com/114x100.png/5fa2dd/ffffff,$60.56,fashion,Paintings
Samsung Galaxy S10,facilisi cras non velit nec nisi vulputate nonummy maecenas tincidunt lacus at velit vivamus vel nulla,http://dummyimage.com/137x100.png/ff4444/ffffff,$99.79,books,Coins
Canon EOS Rebel T6,justo sit amet sapien dignissim vestibulum vestibulum ante ipsum primis in faucibus orci luctus et ultrices posuere cubilia curae nulla dapibus dolor vel est donec odio justo sollicitudin ut suscipit a feugiat,http://dummyimage.com/195x100.png/ff4444/ffffff,$65.35,art,Books
Gucci GG Marmont Bag,lobortis ligula sit amet eleifend pede libero quis orci nullam molestie nibh in lectus pellentesque at nulla suspendisse potenti cras in purus eu magna vulputate luctus cum sociis natoque penatibus et magnis dis parturient montes nascetur ridiculus mus vivamus vestibulum sagittis sapien cum sociis natoque penatibus et magnis dis,http://dummyimage.com/178x100.png/5fa2dd/ffffff,$54.99,food,Coins
Bose QuietComfort 35 II,duis bibendum morbi non quam nec dui luctus rutrum nulla tellus in sagittis dui vel nisl duis ac nibh fusce lacus purus aliquet,http://dummyimage.com/191x100.png/5fa2dd/ffffff,$66.95,food,Books
Gucci GG Marmont Bag,justo lacinia eget tincidunt eget tempus vel pede morbi porttitor lorem id ligula suspendisse ornare consequat lectus in est risus auctor sed tristique in tempus sit amet sem fusce consequat nulla nisl nunc nisl duis,http://dummyimage.com/232x100.png/ff4444/ffffff,$22.19,books,Antiques
MacBook Pro,proin eu mi nulla ac enim in tempor turpis nec euismod scelerisque quam turpis adipiscing lorem vitae,http://dummyimage.com/237x100.png/cc0000/ffffff,$84.12,fashion,Books
Chanel Coco Mademoiselle Perfume,varius ut blandit non interdum in ante vestibulum ante ipsum primis in faucibus orci luctus et ultrices posuere cubilia curae duis faucibus accumsan odio curabitur convallis duis consequat dui nec nisi volutpat eleifend donec ut dolor morbi vel lectus in quam fringilla rhoncus,http://dummyimage.com/146x100.png/5fa2dd/ffffff,$84.30,technology,Stamps
Amazon Echo Dot,hendrerit at vulputate vitae nisl aenean lectus pellentesque eget nunc donec quis orci eget orci vehicula condimentum curabitur in libero ut massa volutpat convallis morbi odio odio elementum eu interdum eu tincidunt in leo maecenas pulvinar lobortis est phasellus sit amet erat nulla tempus vivamus in,http://dummyimage.com/230x100.png/5fa2dd/ffffff,$31.76,books,Coins
Nintendo Switch,mus etiam vel augue vestibulum rutrum rutrum neque aenean auctor gravida sem,http://dummyimage.com/174x100.png/5fa2dd/ffffff,$50.01,fitness,Antiques
Canon EOS Rebel T6,semper rutrum nulla nunc purus phasellus in felis donec semper sapien a libero nam dui proin leo odio porttitor id consequat in consequat ut nulla sed accumsan felis ut at dolor quis odio consequat varius,http://dummyimage.com/186x100.png/5fa2dd/ffffff,$51.13,travel,Antiques
Lego Star Wars Millennium Falcon,non interdum in ante vestibulum ante ipsum primis in faucibus orci luctus et ultrices posuere cubilia curae duis faucibus accumsan odio curabitur convallis duis consequat dui nec nisi volutpat eleifend donec ut dolor morbi vel lectus in quam fringilla rhoncus mauris enim leo rhoncus sed vestibulum,http://dummyimage.com/197x100.png/ff4444/ffffff,$98.42,art,Books
Dyson V11 Vacuum,quis augue luctus tincidunt nulla mollis molestie lorem quisque ut erat curabitur gravida nisi at nibh in hac habitasse platea dictumst aliquam augue quam sollicitudin vitae consectetuer eget rutrum at lorem integer tincidunt ante vel ipsum praesent blandit lacinia erat vestibulum sed,http://dummyimage.com/167x100.png/cc0000/ffffff,$24.28,technology,Antiques
